,names,dates,url
0,Kneeland v. Luce,1891-11-02,https://www.courtlistener.com/opinion/93163/kneeland-v-luce/
1,United States v. Fisher,1883-11-05,https://www.courtlistener.com/opinion/90913/united-states-v-fisher/
2,Printing House v. Trustees,1882-03-18,https://www.courtlistener.com/opinion/90523/printing-house-v-trustees/
3,"La Nereyda. The Spanish Consul , Libellant",1823-03-15,https://www.courtlistener.com/opinion/85383/la-nereyda-the-spanish-consul-libellant/
4,Lawson v. Suwannee Fruit & SS Co.,1949-02-14,https://www.courtlistener.com/opinion/104631/lawson-v-suwannee-fruit-ss-co/
5,"Foley Bros., Inc. v. Filardo",1949-03-07,https://www.courtlistener.com/opinion/104638/foley-bros-inc-v-filardo/
6,Sweeney v. Lomme,1874-12-21,https://www.courtlistener.com/opinion/89066/sweeney-v-lomme/
7,Commercial Casualty Ins. Co. v. Consolidated Stone Co.,1929-01-02,https://www.courtlistener.com/opinion/101348/commercial-casualty-ins-co-v-consolidated-stone-co/
8,"Raymond B. Yates, MD, PC Profit Sharing Plan v. Hendon",2004-03-02,https://www.courtlistener.com/opinion/134722/raymond-b-yates-md-pc-profit-sharing-plan-v-hendon/
9,Davis v. Monroe County Bd. of Ed.,1999-05-24,https://www.courtlistener.com/opinion/118290/davis-v-monroe-county-bd-of-ed/
10,Marshall v. Delaware Ins. Co.,1808-02-23,https://www.courtlistener.com/opinion/84854/marshall-v-delaware-ins-co/
11,"The"" Clara""",1880-11-29,https://www.courtlistener.com/opinion/90232/the-clara/
12,Interstate Commerce Commission v. Jersey City,1944-10-09,https://www.courtlistener.com/opinion/104007/interstate-commerce-commission-v-jersey-city/
13,Sioux City & Iowa Falls Town Lot & Land Co. v. Griffey,1892-02-01,https://www.courtlistener.com/opinion/93252/sioux-city-iowa-falls-town-lot-land-co-v-griffey/
14,United States v. Central Eureka Mining Co.,1958-10-13,https://www.courtlistener.com/opinion/105718/united-states-v-central-eureka-mining-co/
15,Phipps v. Cleveland Refining Co. of Cleveland,1923-04-09,https://www.courtlistener.com/opinion/100170/phipps-v-cleveland-refining-co-of-cleveland/
16,United States v. McCULLAGH,1852-05-18,https://www.courtlistener.com/opinion/86735/united-states-v-mccullagh/
17,Sun Printing and Publishing Assn. v. Moore,1902-01-13,https://www.courtlistener.com/opinion/95570/sun-printing-and-publishing-assn-v-moore/
18,Government Employees v. Windsor,1957-05-13,https://www.courtlistener.com/opinion/105504/government-employees-v-windsor/
19,Vachon v. New Hampshire,1974-02-25,https://www.courtlistener.com/opinion/108905/vachon-v-new-hampshire/
20,O'Shea v. Littleton,1974-01-15,https://www.courtlistener.com/opinion/108906/oshea-v-littleton/
21,ICC v. Railway Labor Executives' Assn.,1942-03-02,https://www.courtlistener.com/opinion/103618/icc-v-railway-labor-executives-assn/
22,Board of Trade of Chicago v. Christie Grain & Stock Co.,1905-05-08,https://www.courtlistener.com/opinion/96295/board-of-trade-of-chicago-v-christie-grain-stock-co/
23,United States v. Young,1985-02-20,https://www.courtlistener.com/opinion/111353/united-states-v-young/
24,Ake v. Oklahoma,1985-02-26,https://www.courtlistener.com/opinion/111356/ake-v-oklahoma/
25,United States v. Ripley,1833-02-26,https://www.courtlistener.com/opinion/85811/united-states-v-ripley/
26,Interstate Commerce Commission v. Columbus & Greenville Ry. Co,1943-10-11,https://www.courtlistener.com/opinion/103863/interstate-commerce-commission-v-columbus-greenville-ry-co/
27,Thomas v. Sugarman,1910-05-31,https://www.courtlistener.com/opinion/97282/thomas-v-sugarman/
28,Helvering v. Newport Co.,1934-03-05,https://www.courtlistener.com/opinion/102222/helvering-v-newport-co/
29,Niles-Bement-Pond Co. v. Iron Moulders,1920-11-08,https://www.courtlistener.com/opinion/99643/niles-bement-pond-co-v-iron-moulders/
30,Block v. Rutherford,1984-07-03,https://www.courtlistener.com/opinion/111254/block-v-rutherford/
31,Travelers Indemnity Co. v. Bailey,2009-06-18,https://www.courtlistener.com/opinion/145858/travelers-indemnity-co-v-bailey/
32,Alaska SS Co. v. Petterson,1954-06-01,https://www.courtlistener.com/opinion/105215/alaska-ss-co-v-petterson/
33,United States v. Moore,1878-02-18,https://www.courtlistener.com/opinion/89660/united-states-v-moore/
34,City of Paris,1870-04-11,https://www.courtlistener.com/opinion/88204/city-of-paris/
35,Roughton v. Knight,1911-02-20,https://www.courtlistener.com/opinion/97367/roughton-v-knight/
36,Northern Pacific R. Co. v. Wass,1911-02-20,https://www.courtlistener.com/opinion/97360/northern-pacific-r-co-v-wass/
37,Hutchinson Ice Cream Co. v. Iowa,1916-12-04,https://www.courtlistener.com/opinion/98810/hutchinson-ice-cream-co-v-iowa/
38,United States v. Northern Pacific R. Co.,1916-12-04,https://www.courtlistener.com/opinion/98815/united-states-v-northern-pacific-r-co/
39,United States v. Pennsylvania R. Co.,1916-12-11,https://www.courtlistener.com/opinion/98819/united-states-v-pennsylvania-r-co/
40,United States v. Russell,1973-04-24,https://www.courtlistener.com/opinion/108768/united-states-v-russell/
41,Hornbuckle v. Stafford,1884-04-21,https://www.courtlistener.com/opinion/91123/hornbuckle-v-stafford/
42,Minturn v. Maynard,1855-03-10,https://www.courtlistener.com/opinion/86949/minturn-v-maynard/
43,The Apollon.,1824-03-22,https://www.courtlistener.com/opinion/85416/the-apollon/
44,"United States, Appt. v. Albert C. Engard",1905-02-20,https://www.courtlistener.com/opinion/96215/united-states-appt-v-albert-c-engard/
45,"Chicago Great Western Railway Company, Plff. In Err. v. State of Minnesota",1910-02-21,https://www.courtlistener.com/opinion/97167/chicago-great-western-railway-company-plff-in-err-v-state-of-minnesota/
46,Wabash Western R. Co. v. Brow,1896-11-30,https://www.courtlistener.com/opinion/94539/wabash-western-r-co-v-brow/
47,Snyder v. Harris,1969-05-05,https://www.courtlistener.com/opinion/107884/snyder-v-harris/
48,St. Martin Evangelical Lutheran Church v. South Dakota,1981-05-26,https://www.courtlistener.com/opinion/110489/st-martin-evangelical-lutheran-church-v-south-dakota/
49,Fond Du Lac County v. May,1890-12-15,https://www.courtlistener.com/opinion/92891/fond-du-lac-county-v-may/
50,Dunlop v. Bachowski,1975-06-02,https://www.courtlistener.com/opinion/109260/dunlop-v-bachowski/
51,John Archer v. Mary Deneale,1828-02-18,https://www.courtlistener.com/opinion/85603/john-archer-v-mary-deneale/
52,United States v. Samuel Brewster,1833-03-13,https://www.courtlistener.com/opinion/85822/united-states-v-samuel-brewster/
53,Holmes and Others v. Trout and Others,1833-02-14,https://www.courtlistener.com/opinion/85824/holmes-and-others-v-trout-and-others/
54,United States v. Feola,1975-03-19,https://www.courtlistener.com/opinion/109220/united-states-v-feola/
55,Martin v. Texas,1906-02-19,https://www.courtlistener.com/opinion/96404/martin-v-texas/
56,United States v. Gaskin,1944-01-03,https://www.courtlistener.com/opinion/103908/united-states-v-gaskin/
57,Bank of Metropolis v. New England Bank,1843-03-13,https://www.courtlistener.com/opinion/86252/bank-of-metropolis-v-new-england-bank/
58,Bybee v. Oregon & California R. Co.,1891-04-20,https://www.courtlistener.com/opinion/93054/bybee-v-oregon-california-r-co/
59,Carite v. Trotot,1882-05-18,https://www.courtlistener.com/opinion/90637/carite-v-trotot/
60,Hollis v. Kutz,1921-03-28,https://www.courtlistener.com/opinion/99760/hollis-v-kutz/
61,Wright v. Central of Georgia R. Co.,1915-03-22,https://www.courtlistener.com/opinion/98400/wright-v-central-of-georgia-r-co/
62,Richardson v. Belcher,1971-11-22,https://www.courtlistener.com/opinion/108405/richardson-v-belcher/
63,Delassus v. United States,1835-02-18,https://www.courtlistener.com/opinion/85922/delassus-v-united-states/
64,Connolly v. Pension Benefit Guaranty Corporation,1986-02-26,https://www.courtlistener.com/opinion/111605/connolly-v-pension-benefit-guaranty-corporation/
65,Hot Springs R. Co. v. Williamson,1890-05-19,https://www.courtlistener.com/opinion/92815/hot-springs-r-co-v-williamson/
66,"Edmund Rice, in Error v. The Minnesota and Northwestern Railroad Company",1858-12-28,https://www.courtlistener.com/opinion/87194/edmund-rice-in-error-v-the-minnesota-and-northwestern-railroad-company/
67,Metropolitan Edison Co. v. People Against Nuclear Energy,1983-04-19,https://www.courtlistener.com/opinion/110903/metropolitan-edison-co-v-people-against-nuclear-energy/
68,Alaska v. Troy,1922-02-27,https://www.courtlistener.com/opinion/99926/alaska-v-troy/
