,names,dates,url
0,United States v. Bowman,1922-11-13,https://www.courtlistener.com/opinion/100042/united-states-v-bowman/
1,"The State of Pennsylvania v. The Wheeling and Belmont Bridge Company, William Ottersan, and George Croft",1850-05-29,https://www.courtlistener.com/opinion/86590/the-state-of-pennsylvania-v-the-wheeling-and-belmont-bridge-company/
2,Malloy v. Hogan,1964-06-15,https://www.courtlistener.com/opinion/106862/malloy-v-hogan/
3,Interstate Land Co. v. Maxwell Land Grant Co.,1891-04-06,https://www.courtlistener.com/opinion/93042/interstate-land-co-v-maxwell-land-grant-co/
4,United States v. Cores,1958-05-19,https://www.courtlistener.com/opinion/105684/united-states-v-cores/
5,Osborne v. Adams County,1883-10-15,https://www.courtlistener.com/opinion/90896/osborne-v-adams-county/
6,Lake Shore & Michigan Southern R. Co. v. National Car-Brake Shoe Co.,1884-01-28,https://www.courtlistener.com/opinion/91025/lake-shore-michigan-southern-r-co-v-national-car-brake-shoe-co/
7,Mullen v. Western Union Beef Co.,1899-02-20,https://www.courtlistener.com/opinion/94999/mullen-v-western-union-beef-co/
