,names,dates,url
0,Comanche County v. Lewis,1890-01-27,https://www.courtlistener.com/opinion/92661/comanche-county-v-lewis/
1,Odom v. United States,1970-12-21,https://www.courtlistener.com/opinion/108214/odom-v-united-states/
2,Sullivan v. Iron Silver Mining Co.,1883-12-17,https://www.courtlistener.com/opinion/90964/sullivan-v-iron-silver-mining-co/
3,National Bank v. Case,1879-04-21,https://www.courtlistener.com/opinion/89992/national-bank-v-case/
4,Commissioner v. Bilder,1962-04-30,https://www.courtlistener.com/opinion/106387/commissioner-v-bilder/
5,Yale Lock Mfg. Co. v. Greenleaf,1886-04-05,https://www.courtlistener.com/opinion/91637/yale-lock-mfg-co-v-greenleaf/
6,Memorial Hospital v. Maricopa County,1974-02-26,https://www.courtlistener.com/opinion/108971/memorial-hospital-v-maricopa-county/
7,Davis v. O'HARA,1924-11-24,https://www.courtlistener.com/opinion/100517/davis-v-ohara/
8,Citizen Publishing Co. v. United States,1969-03-10,https://www.courtlistener.com/opinion/107870/citizen-publishing-co-v-united-states/
9,United States v. Lewis,1914-11-30,https://www.courtlistener.com/opinion/98294/united-states-v-lewis/
10,United States v. Dashiel,1866-04-18,https://www.courtlistener.com/opinion/87746/united-states-v-dashiel/
11,Work v. United States Ex Rel. Lynn,1924-11-17,https://www.courtlistener.com/opinion/100490/work-v-united-states-ex-rel-lynn/
12,Wabash R. Co. v. Tourville,1900-12-10,https://www.courtlistener.com/opinion/95362/wabash-r-co-v-tourville/
13,United States v. Samuel J. Morgan,1869-04-12,https://www.courtlistener.com/opinion/93972/united-states-v-samuel-j-morgan/
14,"William Taylor and Others v. George M. Savage, of Samuel Savage, Deceased",1844-03-12,https://www.courtlistener.com/opinion/86286/william-taylor-and-others-v-george-m-savage-of-samuel-savage-deceased/
15,Railroad Cos. v. Gaines,1878-12-18,https://www.courtlistener.com/opinion/89840/railroad-cos-v-gaines/
16,The Frances,1814-03-12,https://www.courtlistener.com/opinion/1394601/the-frances/
17,New Orleans v. Stempel,1899-12-04,https://www.courtlistener.com/opinion/95126/new-orleans-v-stempel/
18,United States v. Mandujano,1976-05-19,https://www.courtlistener.com/opinion/109442/united-states-v-mandujano/
19,ICC v. United States Ex Rel. Members of Waste Merchants Assn. of NY,1922-10-23,https://www.courtlistener.com/opinion/100035/icc-v-united-states-ex-rel-members-of-waste-merchants-assn-of-ny/
20,"C. & NW RY. v. Nye, Etc., Co.",1922-11-13,https://www.courtlistener.com/opinion/100036/c-nw-ry-v-nye-etc-co/
21,"California Retail Liquor Dealers Assn. v. Midcal Aluminum, Inc.",1980-03-03,https://www.courtlistener.com/opinion/110215/california-retail-liquor-dealers-assn-v-midcal-aluminum-inc/
22,Labor Board v. I. & M. ELECTRIC CO.,1943-01-18,https://www.courtlistener.com/opinion/103763/labor-board-v-i-m-electric-co/
23,Shoecraft v. Trustees of the Internal Improvement Fund of the State of Florida,1888-02-20,https://www.courtlistener.com/opinion/92168/shoecraft-v-trustees-of-the-internal-improvement-fund-of-the-state-of/
24,Shenandoah Broadcasting v. ASCAP,1963-10-21,https://www.courtlistener.com/opinion/106687/shenandoah-broadcasting-v-ascap/
25,"New York Gaslight Club, Inc. v. Carey",1980-06-09,https://www.courtlistener.com/opinion/110291/new-york-gaslight-club-inc-v-carey/
26,Newell v. Nixon,1866-12-17,https://www.courtlistener.com/opinion/87797/newell-v-nixon/
27,Louisville & Nashville R. Co. v. Eubank,1902-01-27,https://www.courtlistener.com/opinion/95576/louisville-nashville-r-co-v-eubank/
28,Berea College v. Kentucky,1908-11-09,https://www.courtlistener.com/opinion/96883/berea-college-v-kentucky/
29,Retzer v. Wood,1883-11-12,https://www.courtlistener.com/opinion/90921/retzer-v-wood/
30,Whitney v. Butler,1886-11-01,https://www.courtlistener.com/opinion/91723/whitney-v-butler/
31,National Cable & Telecommunications Assn. v. Brand X Internet Services,2005-06-27,https://www.courtlistener.com/opinion/799969/national-cable-telecommunications-assn-v-brand-x-internet-services/
32,Allen v. United States,1873-01-13,https://www.courtlistener.com/opinion/88738/allen-v-united-states/
33,Stewart v. United States,1907-05-13,https://www.courtlistener.com/opinion/96675/stewart-v-united-states/
34,Pacific Nat. Bank v. Eaton,1891-05-25,https://www.courtlistener.com/opinion/93144/pacific-nat-bank-v-eaton/
35,Ex Parte Davis,1923-05-21,https://www.courtlistener.com/opinion/2620992/ex-parte-davis/
36,Gleason v. Seaboard Air Line R. Co.,1929-01-02,https://www.courtlistener.com/opinion/101368/gleason-v-seaboard-air-line-r-co/
37,Penna. RR Co. v. Pub. Service Comm.,1919-11-10,https://www.courtlistener.com/opinion/99453/penna-rr-co-v-pub-service-comm/
38,Boswell's Lessee v. Otis,1850-04-11,https://www.courtlistener.com/opinion/86564/boswells-lessee-v-otis/
39,Menendez v. Holt,1888-12-10,https://www.courtlistener.com/opinion/92359/menendez-v-holt/
40,Woods v. Interstate Realty Co.,1949-06-20,https://www.courtlistener.com/opinion/104694/woods-v-interstate-realty-co/
41,De Jonge v. Oregon,1937-01-04,https://www.courtlistener.com/opinion/102728/de-jonge-v-oregon/
42,"Richard Smith, Lessee of John Lanning v. John Vaughan",1836-02-15,https://www.courtlistener.com/opinion/85983/richard-smith-lessee-of-john-lanning-v-john-vaughan/
43,Hayes v. United States,1898-05-23,https://www.courtlistener.com/opinion/94889/hayes-v-united-states/
44,Ruhrgas Ag v. Marathon Oil Co.,1999-05-17,https://www.courtlistener.com/opinion/118288/ruhrgas-ag-v-marathon-oil-co/
45,"Wilentz v. Sovereign Camp, Woodman of the World",1939-04-17,https://www.courtlistener.com/opinion/103185/wilentz-v-sovereign-camp-woodman-of-the-world/
46,Magowan v. New York Belting & Packing Co.,1891-10-26,https://www.courtlistener.com/opinion/93155/magowan-v-new-york-belting-packing-co/
47,Ochoa v. Hernandez Y Morales,1913-06-16,https://www.courtlistener.com/opinion/97958/ochoa-v-hernandez-y-morales/
48,Commissioner v. Flowers,1946-01-07,https://www.courtlistener.com/opinion/104212/commissioner-v-flowers/
49,United States v. Cress,1917-03-12,https://www.courtlistener.com/opinion/98902/united-states-v-cress/
50,Schulde v. Commissioner,1963-02-18,https://www.courtlistener.com/opinion/106533/schulde-v-commissioner/
51,Mitchell v. WT Grant Co.,1974-05-13,https://www.courtlistener.com/opinion/109023/mitchell-v-wt-grant-co/
52,"Fisher's Blend Station, Inc. v. State Tax Comm'n",1936-03-30,https://www.courtlistener.com/opinion/102636/fishers-blend-station-inc-v-state-tax-commn/
53,United States v. Brig Burdett,1835-03-16,https://www.courtlistener.com/opinion/85950/united-states-v-brig-burdett/
54,Shaffer v. Heitner,1977-06-24,https://www.courtlistener.com/opinion/109721/shaffer-v-heitner/
55,Groppi v. Wisconsin,1971-01-25,https://www.courtlistener.com/opinion/108235/groppi-v-wisconsin/
56,Pound v. Turck,1878-01-18,https://www.courtlistener.com/opinion/89623/pound-v-turck/
57,Maish v. Arizona,1896-12-21,https://www.courtlistener.com/opinion/94571/maish-v-arizona/
58,Lawton v. Steele,1894-03-05,https://www.courtlistener.com/opinion/93817/lawton-v-steele/
59,United States v. Howard,1957-01-14,https://www.courtlistener.com/opinion/105438/united-states-v-howard/
60,Stewart v. Keyes,1935-05-20,https://www.courtlistener.com/opinion/102465/stewart-v-keyes/
61,Tempel v. United States,1918-12-09,https://www.courtlistener.com/opinion/99236/tempel-v-united-states/
62,Smith v. United States,1831-01-19,https://www.courtlistener.com/opinion/85732/smith-v-united-states/
63,The Portsmouth,1870-04-11,https://www.courtlistener.com/opinion/88213/the-portsmouth/
