,names,dates,url
0,Johnson v. United States,1971-04-05,https://www.courtlistener.com/opinion/108308/johnson-v-united-states/
1,Balt. & Ohio RR v. Int. Com. Comm.,1911-05-29,https://www.courtlistener.com/opinion/97451/balt-ohio-rr-v-int-com-comm/
2,United States v. Chandler-Dunbar Water Power Co.,1908-04-20,https://www.courtlistener.com/opinion/96844/united-states-v-chandler-dunbar-water-power-co/
3,Brady v. Work,1924-01-07,https://www.courtlistener.com/opinion/100312/brady-v-work/
4,Scudder v. Union Nat. Bank,1875-11-29,https://www.courtlistener.com/opinion/89194/scudder-v-union-nat-bank/
5,Hartford Accident Co. v. Sou. Pacific,1927-02-21,https://www.courtlistener.com/opinion/101001/hartford-accident-co-v-sou-pacific/
