,names,dates,url
0,"Watson v. Cincinnati, I., St. L. & CR Co.",1889-11-18,https://www.courtlistener.com/opinion/92582/watson-v-cincinnati-i-st-l-cr-co/
1,Rockwell Intern. Corp. v. United States,2007-03-27,https://www.courtlistener.com/opinion/145751/rockwell-intern-corp-v-united-states/
2,Warner v. Searle & Hereth Co.,1903-11-30,https://www.courtlistener.com/opinion/95940/warner-v-searle-hereth-co/
3,Ford Motor Co. v. EEOC,1982-06-28,https://www.courtlistener.com/opinion/110775/ford-motor-co-v-eeoc/
4,United States v. Baltimore & Ohio Southwestern R. Co.,1912-11-11,https://www.courtlistener.com/opinion/97690/united-states-v-baltimore-ohio-southwestern-r-co/
