,names,dates,url
0,Hart v. Pennsylvania R. Co.,1884-11-24,https://www.courtlistener.com/opinion/91213/hart-v-pennsylvania-r-co/
1,"Metro-Goldwyn-Mayer Studios Inc. v. Grokster, Ltd.",2005-06-27,https://www.courtlistener.com/opinion/799994/metro-goldwyn-mayer-studios-inc-v-grokster-ltd/
2,Larkin v. Paugh,1928-04-09,https://www.courtlistener.com/opinion/101253/larkin-v-paugh/
3,Frost & Frost Trucking Co. v. Railroad Comm'n of Cal.,1926-06-07,https://www.courtlistener.com/opinion/100914/frost-frost-trucking-co-v-railroad-commn-of-cal/
4,District of Columbia v. Clawans,1937-04-05,https://www.courtlistener.com/opinion/102801/district-of-columbia-v-clawans/
5,"Professional Real Estate Investors, Inc. v. Columbia Pictures Industries, Inc.",1993-05-03,https://www.courtlistener.com/opinion/112855/professional-real-estate-investors-inc-v-columbia-pictures-industries/
