,names,dates,url
0,Glickstein v. United States,1911-12-04,https://www.courtlistener.com/opinion/97476/glickstein-v-united-states/
1,Iron Cliffs Co. v. Negaunee Iron Co.,1905-04-03,https://www.courtlistener.com/opinion/96265/iron-cliffs-co-v-negaunee-iron-co/
2,Graves v. United States,1893-11-06,https://www.courtlistener.com/opinion/93688/graves-v-united-states/
3,Century Indemnity Co. v. Nelson,1938-02-28,https://www.courtlistener.com/opinion/102967/century-indemnity-co-v-nelson/
4,United States v. Employing Lathers Assn. of Chicago,1954-03-08,https://www.courtlistener.com/opinion/105199/united-states-v-employing-lathers-assn-of-chicago/
5,Wheeler Lumber Co. v. United States,1930-05-26,https://www.courtlistener.com/opinion/101591/wheeler-lumber-co-v-united-states/
6,Wiswall v. Sampson,1853-01-18,https://www.courtlistener.com/opinion/86770/wiswall-v-sampson/
7,United States v. Mason,1909-04-05,https://www.courtlistener.com/opinion/97000/united-states-v-mason/
8,Lynch v. Bernal,1870-04-18,https://www.courtlistener.com/opinion/88164/lynch-v-bernal/
