,names,dates,url
0,New Orleans Pacific R. Co. v. United States,1888-01-16,https://www.courtlistener.com/opinion/92102/new-orleans-pacific-r-co-v-united-states/
1,"Babbitt v. Sweet Home Chapter, Communities for Great Ore.",1995-06-29,https://www.courtlistener.com/opinion/2462772/babbitt-v-sweet-home-chapter-communities-for-great-ore/
2,"Time, Inc. v. Hill",1967-01-09,https://www.courtlistener.com/opinion/107325/time-inc-v-hill/
3,Northern Securities Co. v. United States,1904-03-14,https://www.courtlistener.com/opinion/96033/northern-securities-co-v-united-states/
4,"Mitsubishi Motors Corp. v. Soler Chrysler-Plymouth, Inc.",1985-07-02,https://www.courtlistener.com/opinion/111513/mitsubishi-motors-corp-v-soler-chrysler-plymouth-inc/
5,Cochran v. United States,1921-01-03,https://www.courtlistener.com/opinion/99681/cochran-v-united-states/
6,Western Union Telegraph Co. v. Priester,1928-02-20,https://www.courtlistener.com/opinion/101236/western-union-telegraph-co-v-priester/
7,United States v. Billings,1914-02-24,https://www.courtlistener.com/opinion/98079/united-states-v-billings/
8,House v. Mayo,1945-02-05,https://www.courtlistener.com/opinion/104079/house-v-mayo/
