,names,dates,url
0,Astiazaran v. Santa Rita Land & Mining Co.,1893-03-06,https://www.courtlistener.com/opinion/93537/astiazaran-v-santa-rita-land-mining-co/
1,Catlin v. United States,1945-02-26,https://www.courtlistener.com/opinion/104095/catlin-v-united-states/
2,Levitt v. Committee for Public Ed. & Religious Liberty,1973-06-25,https://www.courtlistener.com/opinion/108852/levitt-v-committee-for-public-ed-religious-liberty/
3,Ferguson v. Skrupa,1963-04-22,https://www.courtlistener.com/opinion/106576/ferguson-v-skrupa/
4,FTC v. Simplicity Pattern Co.,1959-10-12,https://www.courtlistener.com/opinion/105900/ftc-v-simplicity-pattern-co/
5,Boyd v. Nebraska Ex Rel. Thayer,1892-02-01,https://www.courtlistener.com/opinion/93259/boyd-v-nebraska-ex-rel-thayer/
6,Deckert v. Independence Shares Corp.,1940-12-09,https://www.courtlistener.com/opinion/103409/deckert-v-independence-shares-corp/
7,Reynoldsville Casket Co. v. Hyde,1995-05-15,https://www.courtlistener.com/opinion/117933/reynoldsville-casket-co-v-hyde/
8,"United States v. Dwight Dion, Sr",1986-06-11,https://www.courtlistener.com/opinion/111689/united-states-v-dwight-dion-sr/
