,names,dates,url
0,White v. Barber,1887-12-05,https://www.courtlistener.com/opinion/92056/white-v-barber/
1,"Ogden, Administrator of Cornell v. Blackledge, of Salter",1804-03-18,https://www.courtlistener.com/opinion/84786/ogden-administrator-of-cornell-v-blackledge-of-salter/
2,Halbert v. United States,1931-06-01,https://www.courtlistener.com/opinion/101776/halbert-v-united-states/
3,Stucky v. Masonic Savings Bank,1883-03-05,https://www.courtlistener.com/opinion/90826/stucky-v-masonic-savings-bank/
4,Schell v. Cochran,1883-05-18,https://www.courtlistener.com/opinion/90799/schell-v-cochran/
5,Sparks and Another v. Pierce and Others. 1,1885-11-16,https://www.courtlistener.com/opinion/91460/sparks-and-another-v-pierce-and-others-1/
6,Hanover Star Milling Co. v. Metcalf,1916-03-13,https://www.courtlistener.com/opinion/98674/hanover-star-milling-co-v-metcalf/
7,Texas & Pacific R. Co. v. Bigger,1915-12-13,https://www.courtlistener.com/opinion/98583/texas-pacific-r-co-v-bigger/
8,United States v. Louisiana,1950-06-05,https://www.courtlistener.com/opinion/104810/united-states-v-louisiana/
9,United States v. Texas,1950-06-05,https://www.courtlistener.com/opinion/104811/united-states-v-texas/
10,Kewanee Oil Co. v. Bicron Corp.,1974-05-13,https://www.courtlistener.com/opinion/109018/kewanee-oil-co-v-bicron-corp/
11,Gilmer v. Interstate/Johnson Lane Corp.,1991-05-13,https://www.courtlistener.com/opinion/112584/gilmer-v-interstatejohnson-lane-corp/
12,Carpenters Union v. Labor Board,1951-06-04,https://www.courtlistener.com/opinion/104922/carpenters-union-v-labor-board/
13,Stevens v. Department of Treasury,1991-04-24,https://www.courtlistener.com/opinion/112582/stevens-v-department-of-treasury/
14,Labor Board v. Denver Bldg. Council,1951-06-04,https://www.courtlistener.com/opinion/104920/labor-board-v-denver-bldg-council/
15,Wolff v. McDonnell,1974-06-26,https://www.courtlistener.com/opinion/109097/wolff-v-mcdonnell/
16,Corbett v. Nutt,1871-01-18,https://www.courtlistener.com/opinion/88279/corbett-v-nutt/
17,Purdy v. Lansing,1888-12-10,https://www.courtlistener.com/opinion/92363/purdy-v-lansing/
18,Polk Co. v. Glover,1938-11-07,https://www.courtlistener.com/opinion/103081/polk-co-v-glover/
19,Will v. United States,1967-11-13,https://www.courtlistener.com/opinion/107539/will-v-united-states/
20,Jefferson v. Fink,1918-06-03,https://www.courtlistener.com/opinion/99192/jefferson-v-fink/
21,"NLRB v. J. Weingarten, Inc.",1975-02-19,https://www.courtlistener.com/opinion/109194/nlrb-v-j-weingarten-inc/
22,Myers v. International Trust Co.,1927-02-21,https://www.courtlistener.com/opinion/101023/myers-v-international-trust-co/
23,Alexander v. Sandoval,2001-04-24,https://www.courtlistener.com/opinion/2620697/alexander-v-sandoval/
24,Manners v. Morosco,1920-03-22,https://www.courtlistener.com/opinion/99547/manners-v-morosco/
25,Northern Pacific R. Co. v. Whalen,1893-04-24,https://www.courtlistener.com/opinion/93607/northern-pacific-r-co-v-whalen/
26,Cook v. Lillo,1881-03-21,https://www.courtlistener.com/opinion/90407/cook-v-lillo/
27,Newman v. Gates,1907-01-07,https://www.courtlistener.com/opinion/96564/newman-v-gates/
28,"New York, LE & WR Co. v. Winter's Administrator",1892-02-01,https://www.courtlistener.com/opinion/93254/new-york-le-wr-co-v-winters-administrator/
29,United States v. Baltimore & Ohio R. Co.,1913-12-01,https://www.courtlistener.com/opinion/98002/united-states-v-baltimore-ohio-r-co/
30,Railroad Co. v. Lindsay,1866-12-26,https://www.courtlistener.com/opinion/87805/railroad-co-v-lindsay/
31,Sully v. American Nat. Bank,1900-10-22,https://www.courtlistener.com/opinion/95334/sully-v-american-nat-bank/
32,United States v. Soldana,1918-04-15,https://www.courtlistener.com/opinion/99149/united-states-v-soldana/
33,Beidler v. South Carolina Tax Comm'n,1930-11-24,https://www.courtlistener.com/opinion/101611/beidler-v-south-carolina-tax-commn/
34,Merchants' Ins. Co. v. Allen,1887-03-28,https://www.courtlistener.com/opinion/91897/merchants-ins-co-v-allen/
35,Texas & Pacific R. Co. v. Bloom's Administrator,1897-01-04,https://www.courtlistener.com/opinion/1100681/texas-pacific-r-co-v-blooms-administrator/
36,United States v. Fillebrown,1833-02-22,https://www.courtlistener.com/opinion/85812/united-states-v-fillebrown/
37,"Bandini Petroleum Co. v. Superior Court, Los Angeles Cty.",1931-11-23,https://www.courtlistener.com/opinion/101792/bandini-petroleum-co-v-superior-court-los-angeles-cty/
38,Santa Fe Pacific R. Co. v. Holmes,1906-05-21,https://www.courtlistener.com/opinion/96484/santa-fe-pacific-r-co-v-holmes/
39,United States v. Stanford,1896-03-02,https://www.courtlistener.com/opinion/94394/united-states-v-stanford/
40,Watson v. State Comptroller of NY,1920-11-15,https://www.courtlistener.com/opinion/99649/watson-v-state-comptroller-of-ny/
41,United States v. Pennsylvania R. Co.,1945-01-29,https://www.courtlistener.com/opinion/1329403/united-states-v-pennsylvania-r-co/
42,Harris v. Quinn,2014-06-30,https://www.courtlistener.com/opinion/2681318/harris-v-quinn/
43,United States v. 422 Casks of Wine,1828-02-15,https://www.courtlistener.com/opinion/85596/united-states-v-422-casks-of-wine/
44,Callan v. May,1863-01-14,https://www.courtlistener.com/opinion/87524/callan-v-may/
45,Supervisors v. Stanley,1882-04-18,https://www.courtlistener.com/opinion/90577/supervisors-v-stanley/
46,United Building & Constr. Trades Council of Camden Cty. v. Mayor and Council of Camden,1984-02-21,https://www.courtlistener.com/opinion/111097/united-building-constr-trades-council-of-camden-cty-v-mayor-and/
47,"Case-Swayne Co. v. Sunkist Growers, Inc.",1968-01-29,https://www.courtlistener.com/opinion/107566/case-swayne-co-v-sunkist-growers-inc/
48,Rosenbloom v. United States,1957-11-25,https://www.courtlistener.com/opinion/105581/rosenbloom-v-united-states/
49,Baltimore & Ohio R. Co. v. Brady,1933-03-13,https://www.courtlistener.com/opinion/102050/baltimore-ohio-r-co-v-brady/
50,Schuette v. BAMN,2014-04-22,https://www.courtlistener.com/opinion/2672208/schuette-v-bamn/
51,Southern R. Co. v. Hussey,1931-04-13,https://www.courtlistener.com/opinion/101710/southern-r-co-v-hussey/
52,Steam-Engine Co. v. Hubbard,1879-11-24,https://www.courtlistener.com/opinion/90111/steam-engine-co-v-hubbard/
53,May v. Sloan,1879-12-18,https://www.courtlistener.com/opinion/90118/may-v-sloan/
54,James Todd v. Otis Daniell,1843-03-10,https://www.courtlistener.com/opinion/86259/james-todd-v-otis-daniell/
55,Greene v. McElroy,1959-06-29,https://www.courtlistener.com/opinion/105930/greene-v-mcelroy/
56,Hay v. May Department Stores Co.,1926-05-24,https://www.courtlistener.com/opinion/100886/hay-v-may-department-stores-co/
57,Trust Co. v. Sedgwick,1878-03-25,https://www.courtlistener.com/opinion/89791/trust-co-v-sedgwick/
58,Wong Wing v. United States,1896-05-18,https://www.courtlistener.com/opinion/94479/wong-wing-v-united-states/
59,English v. General Elec. Co.,1990-06-04,https://www.courtlistener.com/opinion/112446/english-v-general-elec-co/
60,St. Louis Southwestern R. Co. v. Dickerson,1985-03-04,https://www.courtlistener.com/opinion/111367/st-louis-southwestern-r-co-v-dickerson/
61,Central Trust Co. v. McGeorge,1894-01-03,https://www.courtlistener.com/opinion/93752/central-trust-co-v-mcgeorge/
62,Western Distrib'g Co. v. Comm'n.,1932-02-29,https://www.courtlistener.com/opinion/101868/western-distribg-co-v-commn/
63,"United States v. Erika, Inc.",1982-04-20,https://www.courtlistener.com/opinion/110695/united-states-v-erika-inc/
64,"International Longshoremen's Association v. Allied International, Inc.",1982-04-20,https://www.courtlistener.com/opinion/110696/international-longshoremens-association-v-allied-international-inc/
65,NLRB v. Transportation Management Corp.,1983-06-15,https://www.courtlistener.com/opinion/110966/nlrb-v-transportation-management-corp/
