,names,dates,url
0,United States v. Roselius,1853-12-23,https://www.courtlistener.com/opinion/86817/united-states-v-roselius/
1,"Franklin S. Jerome, Plff. In Err. v. Charles P. Cogswell, the State Savings Bank",1907-01-07,https://www.courtlistener.com/opinion/96556/franklin-s-jerome-plff-in-err-v-charles-p-cogswell-the-state-savings/
2,Wolfle v. United States,1934-01-08,https://www.courtlistener.com/opinion/102181/wolfle-v-united-states/
3,Union Pacific R. Co. v. United States,1886-03-29,https://www.courtlistener.com/opinion/91614/union-pacific-r-co-v-united-states/
4,United States v. Rodriquez,2008-05-19,https://www.courtlistener.com/opinion/145808/united-states-v-rodriquez/
5,"Antoine v. Byers & Anderson, Inc.",1993-06-07,https://www.courtlistener.com/opinion/112876/antoine-v-byers-anderson-inc/
6,Struthers v. Drexel,1887-05-27,https://www.courtlistener.com/opinion/92000/struthers-v-drexel/
