,names,dates,url
0,"Intel Corp. v. Advanced Micro Devices, Inc.",2004-06-21,https://www.courtlistener.com/opinion/136993/intel-corp-v-advanced-micro-devices-inc/
1,Tuan Anh Nguyen v. INS,2001-06-11,https://www.courtlistener.com/opinion/118444/tuan-anh-nguyen-v-ins/
2,Marsteller and Others v. McClean,1812-03-13,https://www.courtlistener.com/opinion/84981/marsteller-and-others-v-mcclean/
3,"CAB v. Delta Air Lines, Inc.",1961-06-12,https://www.courtlistener.com/opinion/106271/cab-v-delta-air-lines-inc/
4,Fremont v. United States,1855-03-10,https://www.courtlistener.com/opinion/86952/fremont-v-united-states/
5,Ohio & Mississippi R. Co. v. Wheeler,1862-02-17,https://www.courtlistener.com/opinion/87466/ohio-mississippi-r-co-v-wheeler/
