,names,dates,url
0,Mintzes v. Buchanon,1985-04-15,https://www.courtlistener.com/opinion/111409/mintzes-v-buchanon/
1,United States v. Wunderlich,1951-12-03,https://www.courtlistener.com/opinion/104935/united-states-v-wunderlich/
2,"Scripps-Howard Radio, Inc. v. FCC",1942-04-06,https://www.courtlistener.com/opinion/103651/scripps-howard-radio-inc-v-fcc/
3,New York Times Co. v. Sullivan,1964-03-09,https://www.courtlistener.com/opinion/106761/new-york-times-co-v-sullivan/
4,Ainsa v. United States,1902-03-17,https://www.courtlistener.com/opinion/95619/ainsa-v-united-states/
5,United States v. Harris,1940-12-09,https://www.courtlistener.com/opinion/103410/united-states-v-harris/
