,names,dates,url
0,Bell v. First Nat. Bank of Chicago,1885-11-16,https://www.courtlistener.com/opinion/91457/bell-v-first-nat-bank-of-chicago/
1,Commercial Corp. v. NY Barge Corp.,1941-11-17,https://www.courtlistener.com/opinion/1210205/commercial-corp-v-ny-barge-corp/
2,"FTC v. Phoebe Putney Health System, Inc.",2013-02-19,https://www.courtlistener.com/opinion/820745/ftc-v-phoebe-putney-health-system-inc/
3,McLoughlin v. Raphael Tuck Co.,1903-11-30,https://www.courtlistener.com/opinion/95945/mcloughlin-v-raphael-tuck-co/
4,"Ensten v. Simon, Ascher & Co.",1931-02-02,https://www.courtlistener.com/opinion/101655/ensten-v-simon-ascher-co/
5,"Ensten v. Simon, Ascher & Co.",1931-02-02,https://www.courtlistener.com/opinion/101655/ensten-v-simon-ascher-co/
