,names,dates,url
0,United States v. Hack,1834-03-18,https://www.courtlistener.com/opinion/85876/united-states-v-hack/
1,Mitchell v. Hampel,1928-03-19,https://www.courtlistener.com/opinion/101243/mitchell-v-hampel/
2,United States v. Kaufman,1925-03-02,https://www.courtlistener.com/opinion/100606/united-states-v-kaufman/
3,Myers v. International Trust Co.,1927-02-21,https://www.courtlistener.com/opinion/101023/myers-v-international-trust-co/
4,Francis v. McNeal,1913-05-26,https://www.courtlistener.com/opinion/97889/francis-v-mcneal/
5,Liberty Nat. Bank of Roanoke v. Bear,1924-05-26,https://www.courtlistener.com/opinion/100450/liberty-nat-bank-of-roanoke-v-bear/
6,United States v. Baltimore Post,1925-05-25,https://www.courtlistener.com/opinion/100678/united-states-v-baltimore-post/
7,"Liberty Nat. Bank of Roanoke, Va. v. Bear",1928-10-07,https://www.courtlistener.com/opinion/101231/liberty-nat-bank-of-roanoke-va-v-bear/
