,names,dates,url
0,Garfielde v. United States,1876-05-18,https://www.courtlistener.com/opinion/89370/garfielde-v-united-states/
1,Santa Clara Pueblo v. Martinez,1978-05-15,https://www.courtlistener.com/opinion/109857/santa-clara-pueblo-v-martinez/
2,United States v. Hamburg-Amerikanische Packetfahrt-Actien Gesellschaft,1916-01-10,https://www.courtlistener.com/opinion/98602/united-states-v-hamburg-amerikanische-packetfahrt-actien-gesellschaft/
3,David Shriver Junior's Lessee v. Mary Lynn,1844-02-18,https://www.courtlistener.com/opinion/86265/david-shriver-juniors-lessee-v-mary-lynn/
4,Gwin v. Breedlove,1844-01-31,https://www.courtlistener.com/opinion/86264/gwin-v-breedlove/
5,Arkansas v. Tennessee,1970-02-25,https://www.courtlistener.com/opinion/2764186/arkansas-v-tennessee/
6,Sutter Butte Canal Co. v. Railroad Comm'n of Cal.,1929-04-08,https://www.courtlistener.com/opinion/101402/sutter-butte-canal-co-v-railroad-commn-of-cal/
7,"Webster Coal & Coke Company v. A. J. Cassatt, John B. Thayer, Charles E. Pugh",1907-12-02,https://www.courtlistener.com/opinion/96719/webster-coal-coke-company-v-a-j-cassatt-john-b-thayer-charles-e/
8,Lamaster v. Keeler,1887-12-05,https://www.courtlistener.com/opinion/92055/lamaster-v-keeler/
9,Omaha Street Ry. v. Int. Com. Comm.,1913-06-09,https://www.courtlistener.com/opinion/97964/omaha-street-ry-v-int-com-comm/
10,Medsker v. Bonebrake,1883-03-05,https://www.courtlistener.com/opinion/90825/medsker-v-bonebrake/
11,Postal Service v. Council of Greenburgh Civic Assns.,1981-06-25,https://www.courtlistener.com/opinion/110549/postal-service-v-council-of-greenburgh-civic-assns/
12,Illinois Central R. Co. v. Messina,1916-03-06,https://www.courtlistener.com/opinion/98672/illinois-central-r-co-v-messina/
13,Wayne Gas Co. v. OWENS CO.,1937-02-01,https://www.courtlistener.com/opinion/102761/wayne-gas-co-v-owens-co/
14,Schuylkill & Dauphin Improvement Co. v. Munson,1872-04-22,https://www.courtlistener.com/opinion/88551/schuylkill-dauphin-improvement-co-v-munson/
15,Moore v. Mitchell,1930-02-24,https://www.courtlistener.com/opinion/101526/moore-v-mitchell/
16,Griffin v. School Bd. of Prince Edward Cty.,1964-05-25,https://www.courtlistener.com/opinion/106825/griffin-v-school-bd-of-prince-edward-cty/
17,Williamsport Bank v. Knapp,1886-12-13,https://www.courtlistener.com/opinion/91764/williamsport-bank-v-knapp/
18,Hardy v. United States,1964-01-06,https://www.courtlistener.com/opinion/106719/hardy-v-united-states/
19,Carey v. Westinghouse Elec. Corp.,1964-01-06,https://www.courtlistener.com/opinion/106718/carey-v-westinghouse-elec-corp/
20,Dixon v. United States,1965-05-03,https://www.courtlistener.com/opinion/107048/dixon-v-united-states/
21,"Chicago, RI & PR Co. v. Stude",1954-01-18,https://www.courtlistener.com/opinion/105182/chicago-ri-pr-co-v-stude/
22,United States v. Mitchell,1983-06-27,https://www.courtlistener.com/opinion/110997/united-states-v-mitchell/
23,Pennsylvania v. Nelson,1956-05-14,https://www.courtlistener.com/opinion/105371/pennsylvania-v-nelson/
24,"John C. Sheppard and Others, in Error v. John Wilson",1847-03-18,https://www.courtlistener.com/opinion/86418/john-c-sheppard-and-others-in-error-v-john-wilson/
25,McLean v. Clapp,1891-11-02,https://www.courtlistener.com/opinion/93162/mclean-v-clapp/
26,McCreary v. Pennsylvania Canal Co.,1891-11-09,https://www.courtlistener.com/opinion/93165/mccreary-v-pennsylvania-canal-co/
27,Upton v. Tribilcock,1875-11-18,https://www.courtlistener.com/opinion/89145/upton-v-tribilcock/
28,United States v. Hughes,1824-02-24,https://www.courtlistener.com/opinion/1691871/united-states-v-hughes/
29,McKey v. Hyde Park Village,1890-03-03,https://www.courtlistener.com/opinion/92709/mckey-v-hyde-park-village/
30,Bechtel v. United States,1880-04-19,https://www.courtlistener.com/opinion/90170/bechtel-v-united-states/
31,"Brotherhood of Railroad Trainment v. John P. O'connell, Etc.",1969-05-26,https://www.courtlistener.com/opinion/107947/brotherhood-of-railroad-trainment-v-john-p-oconnell-etc/
32,"Hust v. Moore-McCormack Lines, Inc.",1946-06-10,https://www.courtlistener.com/opinion/104320/hust-v-moore-mccormack-lines-inc/
33,Chesapeake and Ohio Canal Company v. Knapp and Others,1835-03-18,https://www.courtlistener.com/opinion/85944/chesapeake-and-ohio-canal-company-v-knapp-and-others/
34,"Endicott Johnson Corp. v. Encyclopedia Press, Inc.",1924-11-17,https://www.courtlistener.com/opinion/100511/endicott-johnson-corp-v-encyclopedia-press-inc/
35,United States v. Jahn,1894-11-05,https://www.courtlistener.com/opinion/94020/united-states-v-jahn/
36,Juragua Iron Co. v. United States,1909-02-23,https://www.courtlistener.com/opinion/96956/juragua-iron-co-v-united-states/
37,"Larkin v. Grendel's Den, Inc.",1982-12-13,https://www.courtlistener.com/opinion/110814/larkin-v-grendels-den-inc/
38,Royal Ins. Co. v. Martin,1904-01-11,https://www.courtlistener.com/opinion/95986/royal-ins-co-v-martin/
39,Rhodes v. Bell,1844-03-15,https://www.courtlistener.com/opinion/86287/rhodes-v-bell/
40,Anglo-Chilean Nitrate Sales Corp. v. Alabama,1933-02-06,https://www.courtlistener.com/opinion/102029/anglo-chilean-nitrate-sales-corp-v-alabama/
41,White v. Johnson,1931-01-05,https://www.courtlistener.com/opinion/101645/white-v-johnson/
42,In Re Hohorst,1893-12-18,https://www.courtlistener.com/opinion/93739/in-re-hohorst/
43,United States Ex Rel. Hughes v. Gault,1926-05-03,https://www.courtlistener.com/opinion/100860/united-states-ex-rel-hughes-v-gault/
44,McLeod v. Threlkeld,1943-06-07,https://www.courtlistener.com/opinion/103858/mcleod-v-threlkeld/
45,"Minneapolis, St. P. & S. Ste. MR Co. v. Washburn Lignite Coal Co.",1920-12-20,https://www.courtlistener.com/opinion/99677/minneapolis-st-p-s-ste-mr-co-v-washburn-lignite-coal-co/
46,Chapman v. California,1967-03-27,https://www.courtlistener.com/opinion/107359/chapman-v-california/
47,Perkins v. Fourniquet,1853-01-27,https://www.courtlistener.com/opinion/86787/perkins-v-fourniquet/
48,"TWA, INC. v. Independent Federation of Flight Attendants",1989-02-28,https://www.courtlistener.com/opinion/112211/twa-inc-v-independent-federation-of-flight-attendants/
49,Cleveland v. Policy Management Systems Corp.,1999-05-24,https://www.courtlistener.com/opinion/118294/cleveland-v-policy-management-systems-corp/
50,The Hine v. Trevor,1867-04-22,https://www.courtlistener.com/opinion/87796/the-hine-v-trevor/
51,Matter of Dunn,1909-02-23,https://www.courtlistener.com/opinion/96962/matter-of-dunn/
52,Insurance Co. v. Gridley,1880-03-22,https://www.courtlistener.com/opinion/90066/insurance-co-v-gridley/
53,Steele v. Culver,1908-10-26,https://www.courtlistener.com/opinion/96881/steele-v-culver/
54,Fussell v. Gregg,1885-02-02,https://www.courtlistener.com/opinion/91313/fussell-v-gregg/
55,Atlantic Coast Line R. Co. v. Wharton,1907-12-09,https://www.courtlistener.com/opinion/96734/atlantic-coast-line-r-co-v-wharton/
56,"Chicago, M. & St. PR Co. v. Wisconsin",1915-06-21,https://www.courtlistener.com/opinion/98525/chicago-m-st-pr-co-v-wisconsin/
57,"Utah Power & Light Co. v. Pfost, Commissioner of Law Enforcement of State of Idaho",1932-05-16,https://www.courtlistener.com/opinion/101916/utah-power-light-co-v-pfost-commissioner-of-law-enforcement-of-state/
58,Hughes v. Dundee Mortgage Co.,1891-04-27,https://www.courtlistener.com/opinion/93068/hughes-v-dundee-mortgage-co/
59,Vogel v. Gruaz,1884-02-04,https://www.courtlistener.com/opinion/91035/vogel-v-gruaz/
60,"Firefighters v. Boston Chapter, NAACP",1983-05-16,https://www.courtlistener.com/opinion/110931/firefighters-v-boston-chapter-naacp/
61,Bedon v. Davie,1892-03-28,https://www.courtlistener.com/opinion/93309/bedon-v-davie/
62,United States v. Hart,1868-03-30,https://www.courtlistener.com/opinion/87976/united-states-v-hart/
63,"Chicago, M. & St. PR Co. v. Hoyt",1893-04-17,https://www.courtlistener.com/opinion/93595/chicago-m-st-pr-co-v-hoyt/
64,Cooper v. United States,1930-02-24,https://www.courtlistener.com/opinion/101509/cooper-v-united-states/
65,Iron Silver Mining Co. v. Reynolds,1888-01-23,https://www.courtlistener.com/opinion/92131/iron-silver-mining-co-v-reynolds/
66,Broad River Power Co. v. South Carolina Ex Rel. Daniel,1930-05-26,https://www.courtlistener.com/opinion/101589/broad-river-power-co-v-south-carolina-ex-rel-daniel/
67,Marble Co. v. Ripley,1870-12-19,https://www.courtlistener.com/opinion/88266/marble-co-v-ripley/
68,Posados v. Manila,1927-05-31,https://www.courtlistener.com/opinion/101060/posados-v-manila/
69,Kramer v. Union Free School Dist. No. 15,1969-10-13,https://www.courtlistener.com/opinion/107971/kramer-v-union-free-school-dist-no-15/
70,United States v. Boston Ins. Co.,1925-11-23,https://www.courtlistener.com/opinion/100739/united-states-v-boston-ins-co/
71,Shamrock Oil & Gas Corp. v. Sheets,1941-04-28,https://www.courtlistener.com/opinion/103511/shamrock-oil-gas-corp-v-sheets/
72,Connecticut Dept. of Income Maintenance v. Heckler,1985-05-20,https://www.courtlistener.com/opinion/111431/connecticut-dept-of-income-maintenance-v-heckler/
73,Stenberg v. Carhart,2000-06-28,https://www.courtlistener.com/opinion/118387/stenberg-v-carhart/
74,"Liberty Nat. Bank of Roanoke, Va. v. Bear",1928-10-07,https://www.courtlistener.com/opinion/101231/liberty-nat-bank-of-roanoke-va-v-bear/
75,Park v. Cameron,1915-06-01,https://www.courtlistener.com/opinion/98477/park-v-cameron/
