,names,dates,url
0,De Sollar v. Hanscome,1895-05-20,https://www.courtlistener.com/opinion/94204/de-sollar-v-hanscome/
1,Helvering v. Bruun,1940-03-25,https://www.courtlistener.com/opinion/103322/helvering-v-bruun/
2,Keyishian v. Board of Regents of Univ. of State of NY,1966-10-17,https://www.courtlistener.com/opinion/107343/keyishian-v-board-of-regents-of-univ-of-state-of-ny/
3,Senn v. Tile Layers,1937-05-24,https://www.courtlistener.com/opinion/102837/senn-v-tile-layers/
4,United States v. McDaniel,1832-02-14,https://www.courtlistener.com/opinion/85800/united-states-v-mcdaniel/
