,names,dates,url
0,American Express Co. v. Indiana,1897-02-01,https://www.courtlistener.com/opinion/94598/american-express-co-v-indiana/
1,Members of City Council of Los Angeles v. Taxpayers for Vincent,1984-05-15,https://www.courtlistener.com/opinion/111175/members-of-city-council-of-los-angeles-v-taxpayers-for-vincent/
2,"St. L., B. & M. Ry. v. United States",1925-04-27,https://www.courtlistener.com/opinion/100650/st-l-b-m-ry-v-united-states/
3,NLRB v. Retail Store Employees,1980-06-20,https://www.courtlistener.com/opinion/1434992/nlrb-v-retail-store-employees/
4,Chicago & Alton R. Co. v. McWhirt,1917-03-26,https://www.courtlistener.com/opinion/98907/chicago-alton-r-co-v-mcwhirt/
5,Flast v. Cohen,1968-06-10,https://www.courtlistener.com/opinion/107731/flast-v-cohen/
6,Nathanson v. NLRB,1952-11-10,https://www.courtlistener.com/opinion/105037/nathanson-v-nlrb/
7,Sentilles v. Inter-Caribbean Shipping Corp.,1959-11-23,https://www.courtlistener.com/opinion/105964/sentilles-v-inter-caribbean-shipping-corp/
8,Springfield Township School Dist. v. Knoll,1985-04-17,https://www.courtlistener.com/opinion/111416/springfield-township-school-dist-v-knoll/
9,Radovich v. National Football League,1957-04-08,https://www.courtlistener.com/opinion/105457/radovich-v-national-football-league/
10,Abate v. Mundt,1971-06-07,https://www.courtlistener.com/opinion/108365/abate-v-mundt/
11,Edmonson v. Leesville Concrete Co.,1991-06-03,https://www.courtlistener.com/opinion/112610/edmonson-v-leesville-concrete-co/
12,"Missouri, K. & TR Co. v. Haber",1898-03-14,https://www.courtlistener.com/opinion/94840/missouri-k-tr-co-v-haber/
13,Edmonds v. Compagnie Generale Transatlantique,1979-06-27,https://www.courtlistener.com/opinion/110136/edmonds-v-compagnie-generale-transatlantique/
14,Woerishoffer v. United States,1925-11-16,https://www.courtlistener.com/opinion/100722/woerishoffer-v-united-states/
15,Davis v. Burke,1900-12-17,https://www.courtlistener.com/opinion/95368/davis-v-burke/
16,Marek v. Chesny,1985-06-27,https://www.courtlistener.com/opinion/111495/marek-v-chesny/
17,Bear Lake & River Water Works & Irrigation Co. v. Garland,1896-10-19,https://www.courtlistener.com/opinion/94516/bear-lake-river-water-works-irrigation-co-v-garland/
18,Huus v. New York & Porto Rico SS Co.,1901-05-27,https://www.courtlistener.com/opinion/95505/huus-v-new-york-porto-rico-ss-co/
19,"William Taylor and Others v. George M. Savage, of Samuel Savage, Deceased",1844-03-12,https://www.courtlistener.com/opinion/86286/william-taylor-and-others-v-george-m-savage-of-samuel-savage-deceased/
20,Cheely v. Clayton,1884-03-10,https://www.courtlistener.com/opinion/91069/cheely-v-clayton/
21,Payne v. Central Pacific R. Co.,1921-02-28,https://www.courtlistener.com/opinion/99735/payne-v-central-pacific-r-co/
22,Chateaugay Ore & Iron Co. v. Blake,1892-04-11,https://www.courtlistener.com/opinion/93334/chateaugay-ore-iron-co-v-blake/
23,Osterberg v. Union Trust Company,1877-01-15,https://www.courtlistener.com/opinion/89397/osterberg-v-union-trust-company/
24,Grant Brothers Constr. Co. v. United States,1914-03-23,https://www.courtlistener.com/opinion/98125/grant-brothers-constr-co-v-united-states/
25,McLaughlin v. Pacific Lumber Co.,1934-12-10,https://www.courtlistener.com/opinion/102347/mclaughlin-v-pacific-lumber-co/
26,United States v. Reliable Transfer Co.,1975-05-19,https://www.courtlistener.com/opinion/109252/united-states-v-reliable-transfer-co/
27,"George Beach, in Error v. Jonathan Viles in Error",1829-03-20,https://www.courtlistener.com/opinion/85656/george-beach-in-error-v-jonathan-viles-in-error/
28,Neilson v. Lagow,1851-12-18,https://www.courtlistener.com/opinion/86678/neilson-v-lagow/
29,Robinson v. Noble's Administrators,1834-03-18,https://www.courtlistener.com/opinion/85868/robinson-v-nobles-administrators/
30,"NLRB v. Great Dane Trailers, Inc.",1967-06-12,https://www.courtlistener.com/opinion/107482/nlrb-v-great-dane-trailers-inc/
31,"Stephen S. Chandler, United States District Judge for the Western District of Oklahoma v. Judicial Council of the Tenth Circuit of the United States",1966-01-21,https://www.courtlistener.com/opinion/107159/stephen-s-chandler-united-states-district-judge-for-the-western-district/
32,Dumbra v. United States,1925-05-25,https://www.courtlistener.com/opinion/100685/dumbra-v-united-states/
33,St. Louis-San Francisco R. Co. v. Middlekamp,1921-05-02,https://www.courtlistener.com/opinion/99795/st-louis-san-francisco-r-co-v-middlekamp/
34,Blum v. Bacon,1982-06-14,https://www.courtlistener.com/opinion/110736/blum-v-bacon/
35,O'BRIEN v. Wheelock,1902-02-24,https://www.courtlistener.com/opinion/95608/obrien-v-wheelock/
36,The Servia,1893-04-24,https://www.courtlistener.com/opinion/93606/the-servia/
37,Unadilla Valley R. Co. v. Caldine,1928-12-10,https://www.courtlistener.com/opinion/101344/unadilla-valley-r-co-v-caldine/
38,California v. Nevada,1980-06-10,https://www.courtlistener.com/opinion/110294/california-v-nevada/
39,Equitable Surety Co. v. United States Ex Rel. McMillan,1914-06-22,https://www.courtlistener.com/opinion/98240/equitable-surety-co-v-united-states-ex-rel-mcmillan/
40,Western Telegraph Company v. Magnetic Telegraph Company,1859-03-11,https://www.courtlistener.com/opinion/87239/western-telegraph-company-v-magnetic-telegraph-company/
41,United States v. Lorenzetti,1984-05-29,https://www.courtlistener.com/opinion/111192/united-states-v-lorenzetti/
42,Earle v. Pennsylvania,1900-05-14,https://www.courtlistener.com/opinion/95315/earle-v-pennsylvania/
43,Downman v. Texas,1913-12-01,https://www.courtlistener.com/opinion/98009/downman-v-texas/
44,Morales v. New York,1970-01-12,https://www.courtlistener.com/opinion/108004/morales-v-new-york/
45,Shipman v. Straitsville Central Mining Co.,1895-05-20,https://www.courtlistener.com/opinion/94221/shipman-v-straitsville-central-mining-co/
46,Harrison v. Perea,1897-11-29,https://www.courtlistener.com/opinion/94765/harrison-v-perea/
47,Credit Co. v. Arkansas Central R. Co.,1888-11-19,https://www.courtlistener.com/opinion/92331/credit-co-v-arkansas-central-r-co/
48,Dalton Adding MacHine Co. v. Virginia Ex Rel. State Corporation Comm'n,1918-04-15,https://www.courtlistener.com/opinion/99143/dalton-adding-machine-co-v-virginia-ex-rel-state-corporation-commn/
49,Crooks v. Harrelson,1930-11-24,https://www.courtlistener.com/opinion/101617/crooks-v-harrelson/
50,Klein v. Board of Tax Supervisors of Jefferson Cty.,1930-11-24,https://www.courtlistener.com/opinion/101613/klein-v-board-of-tax-supervisors-of-jefferson-cty/
51,"Manual Enterprises, Inc. v. Day",1962-06-25,https://www.courtlistener.com/opinion/106446/manual-enterprises-inc-v-day/
52,Nations v. Johnson,1861-01-21,https://www.courtlistener.com/opinion/87385/nations-v-johnson/
53,Doane v. Glenn,1874-11-23,https://www.courtlistener.com/opinion/88981/doane-v-glenn/
54,Board of Ed. of City School Dist. of New York v. Harris,1979-11-28,https://www.courtlistener.com/opinion/110160/board-of-ed-of-city-school-dist-of-new-york-v-harris/
55,Chicago & Alton R. Co. v. Kirby,1912-05-27,https://www.courtlistener.com/opinion/97650/chicago-alton-r-co-v-kirby/
56,Hess v. United States,1960-01-18,https://www.courtlistener.com/opinion/105986/hess-v-united-states/
57,Boyd v. United States,1926-04-19,https://www.courtlistener.com/opinion/100852/boyd-v-united-states/
58,Kitchen v. Bedford,1872-04-18,https://www.courtlistener.com/opinion/88477/kitchen-v-bedford/
59,"United States Ex Rel. Chicago, New York & Boston Refrigerator Co. v. ICC",1924-05-26,https://www.courtlistener.com/opinion/100441/united-states-ex-rel-chicago-new-york-boston-refrigerator-co-v-icc/
60,Boone v. Lightner,1943-10-11,https://www.courtlistener.com/opinion/103864/boone-v-lightner/
61,"Bandini Petroleum Co. v. Superior Court, Los Angeles Cty.",1931-11-23,https://www.courtlistener.com/opinion/101792/bandini-petroleum-co-v-superior-court-los-angeles-cty/
62,Jaffray v. McGehee,1883-03-19,https://www.courtlistener.com/opinion/90770/jaffray-v-mcgehee/
63,United States v. Acme Process Equipment Co.,1967-01-16,https://www.courtlistener.com/opinion/107302/united-states-v-acme-process-equipment-co/
64,Hughes v. The Union Insurance Company,1818-02-18,https://www.courtlistener.com/opinion/85221/hughes-v-the-union-insurance-company/
65,Conard v. Atlantic Ins. Co. of NY,1828-03-14,https://www.courtlistener.com/opinion/85590/conard-v-atlantic-ins-co-of-ny/
66,General Import Co. v. United States,1932-05-02,https://www.courtlistener.com/opinion/101910/general-import-co-v-united-states/
67,McCormick & Co. v. Brown,1932-05-16,https://www.courtlistener.com/opinion/101914/mccormick-co-v-brown/
68,Humphries v. District of Columbia,1899-05-01,https://www.courtlistener.com/opinion/95058/humphries-v-district-of-columbia/
69,Germann v. United States,1967-12-11,https://www.courtlistener.com/opinion/107562/germann-v-united-states/
70,Fleming v. Fleming,1924-02-18,https://www.courtlistener.com/opinion/100342/fleming-v-fleming/
71,United States v. Hasting,1983-05-23,https://www.courtlistener.com/opinion/110933/united-states-v-hasting/
72,McHarg v. Staake,1906-04-30,https://www.courtlistener.com/opinion/1641560/mcharg-v-staake/
73,Gorman v. Lenox's Executors,1841-02-16,https://www.courtlistener.com/opinion/86165/gorman-v-lenoxs-executors/
74,Great Northern R. Co. v. Minnesota,1910-02-21,https://www.courtlistener.com/opinion/97166/great-northern-r-co-v-minnesota/
75,Washington Market Co. v. District of Columbia,1890-10-27,https://www.courtlistener.com/opinion/92856/washington-market-co-v-district-of-columbia/
76,Benbow v. Iowa City,1869-01-25,https://www.courtlistener.com/opinion/88010/benbow-v-iowa-city/
77,United States v. Hemme,1986-06-03,https://www.courtlistener.com/opinion/111682/united-states-v-hemme/
78,"B&B Hardware, Inc. v. Hargis Industries, Inc.",2015-03-24,https://www.courtlistener.com/opinion/2959751/bb-hardware-inc-v-hargis-industries-inc/
79,James v. United States,2007-04-18,https://www.courtlistener.com/opinion/145743/james-v-united-states/
80,Connell Construction Co. v. Plumbers & Steamfitters Local Union No. 100,1975-10-06,https://www.courtlistener.com/opinion/109262/connell-construction-co-v-plumbers-steamfitters-local-union-no-100/
81,"Benjamin F. Morgan, in Error v. Alfred G. Curtenius and John L. Griswold",1858-01-25,https://www.courtlistener.com/opinion/87117/benjamin-f-morgan-in-error-v-alfred-g-curtenius-and-john-l-griswold/
82,Ex Parte Boyd v. Scott,1851-02-11,https://www.courtlistener.com/opinion/86645/ex-parte-boyd-v-scott/
83,Stockton v. Ford,1851-01-23,https://www.courtlistener.com/opinion/86642/stockton-v-ford/
84,Whitten v. Tomlinson,1895-12-16,https://www.courtlistener.com/opinion/94317/whitten-v-tomlinson/
85,Amadeo v. Zant,1988-05-31,https://www.courtlistener.com/opinion/112078/amadeo-v-zant/
86,Flanders v. Seelye,1882-05-18,https://www.courtlistener.com/opinion/90633/flanders-v-seelye/
87,Swift & Co. v. Hocking Valley R. Co.,1917-03-06,https://www.courtlistener.com/opinion/98897/swift-co-v-hocking-valley-r-co/
88,Excelsior Wooden Pipe Co. v. Pacific Bridge Co.,1902-05-05,https://www.courtlistener.com/opinion/95653/excelsior-wooden-pipe-co-v-pacific-bridge-co/
89,United States v. Green,1902-04-28,https://www.courtlistener.com/opinion/95650/united-states-v-green/
90,St. Louis Railroad v. Terre Haute Railroad,1892-05-16,https://www.courtlistener.com/opinion/93389/st-louis-railroad-v-terre-haute-railroad/
91,Brush v. Condit,1889-11-04,https://www.courtlistener.com/opinion/92566/brush-v-condit/
92,New York Ex Rel. Bryant v. Zimmerman,1928-11-19,https://www.courtlistener.com/opinion/101335/new-york-ex-rel-bryant-v-zimmerman/
93,"Rankin v. Fidelity Ins., Trust & Safe Deposit Co.",1903-04-06,https://www.courtlistener.com/opinion/95847/rankin-v-fidelity-ins-trust-safe-deposit-co/
94,Grunenthal v. Long Island R. Co.,1968-11-18,https://www.courtlistener.com/opinion/107799/grunenthal-v-long-island-r-co/
95,Illinois v. Michigan,1959-10-12,https://www.courtlistener.com/opinion/105939/illinois-v-michigan/
96,Franconia Associates v. United States,2002-06-10,https://www.courtlistener.com/opinion/121150/franconia-associates-v-united-states/
97,Buckley v. Fitzsimmons,1993-06-24,https://www.courtlistener.com/opinion/112894/buckley-v-fitzsimmons/
98,France v. State of Missouri Ex Rel. Smith,1880-10-25,https://www.courtlistener.com/opinion/94004/france-v-state-of-missouri-ex-rel-smith/
