,names,dates,url
0,Howell v. Western Railroad Company,1877-04-30,https://www.courtlistener.com/opinion/89493/howell-v-western-railroad-company/
1,In Re Little,1972-01-24,https://www.courtlistener.com/opinion/108438/in-re-little/
2,Roviaro v. United States,1957-03-25,https://www.courtlistener.com/opinion/105484/roviaro-v-united-states/
3,Satterwhite v. Texas,1988-05-31,https://www.courtlistener.com/opinion/112080/satterwhite-v-texas/
4,"Kaufman v. Societe Internationale Pour Participations Industrielles Et Commerciales, SA",1952-04-07,https://www.courtlistener.com/opinion/104995/kaufman-v-societe-internationale-pour-participations-industrielles-et/
5,The State of Minnesota v. Bachelder,1864-01-18,https://www.courtlistener.com/opinion/87563/the-state-of-minnesota-v-bachelder/
6,Chardon v. Fumero Soto,1983-06-20,https://www.courtlistener.com/opinion/110977/chardon-v-fumero-soto/
7,United States v. Gilmore,1963-02-18,https://www.courtlistener.com/opinion/106528/united-states-v-gilmore/
