,names,dates,url
0,United States v. Adams,1869-04-12,https://www.courtlistener.com/opinion/88028/united-states-v-adams/
1,Illinois Ex Rel. Gordon v. United States,1946-04-22,https://www.courtlistener.com/opinion/104279/illinois-ex-rel-gordon-v-united-states/
2,Farmers and Mechanics Sav. Bank of Minneapolis v. Minnesota,1914-02-24,https://www.courtlistener.com/opinion/98109/farmers-and-mechanics-sav-bank-of-minneapolis-v-minnesota/
3,United States v. Pelican,1914-02-24,https://www.courtlistener.com/opinion/98100/united-states-v-pelican/
4,"Kulko v. Superior Court of Cal., City and County of San Francisco",1978-06-26,https://www.courtlistener.com/opinion/109858/kulko-v-superior-court-of-cal-city-and-county-of-san-francisco/
5,Harrison v. Fortlage,1896-03-02,https://www.courtlistener.com/opinion/94361/harrison-v-fortlage/
6,Dennick v. Railroad Co.,1881-03-21,https://www.courtlistener.com/opinion/90291/dennick-v-railroad-co/
7,Penhallow v. Doane's Administrators,1795-02-24,https://www.courtlistener.com/opinion/2093658/penhallow-v-doanes-administrators/
8,"Douglas v. Seacoast Products, Inc.",1977-05-23,https://www.courtlistener.com/opinion/109662/douglas-v-seacoast-products-inc/
9,Howard v. De Cordova,1900-05-14,https://www.courtlistener.com/opinion/95273/howard-v-de-cordova/
10,NAACP v. Bennett,1959-06-22,https://www.courtlistener.com/opinion/105928/naacp-v-bennett/
11,CITY NATL. BANK v. El Paso RR,1923-06-11,https://www.courtlistener.com/opinion/100255/city-natl-bank-v-el-paso-rr/
12,Southern Pacific Co. v. United States,1939-05-29,https://www.courtlistener.com/opinion/103221/southern-pacific-co-v-united-states/
13,Fleisher v. United States,1937-12-06,https://www.courtlistener.com/opinion/102865/fleisher-v-united-states/
14,New Colonial Ice Co. v. Helvering,1934-05-28,https://www.courtlistener.com/opinion/102283/new-colonial-ice-co-v-helvering/
15,"McCoy v. Court of Appeals of Wis., Dist. 1",1988-06-06,https://www.courtlistener.com/opinion/112088/mccoy-v-court-of-appeals-of-wis-dist-1/
16,United States v. Repentigny,1867-05-18,https://www.courtlistener.com/opinion/87828/united-states-v-repentigny/
17,Colorado v. Bannister,1980-10-20,https://www.courtlistener.com/opinion/110351/colorado-v-bannister/
18,Bindczyck v. Finucane,1951-11-26,https://www.courtlistener.com/opinion/104934/bindczyck-v-finucane/
19,Keppel v. Tiffin Savings Bank,1905-04-03,https://www.courtlistener.com/opinion/96256/keppel-v-tiffin-savings-bank/
20,United States v. Jones,1883-12-17,https://www.courtlistener.com/opinion/90961/united-states-v-jones/
21,"St. Louis, IM & SR Co. v. Wynne",1912-04-15,https://www.courtlistener.com/opinion/97613/st-louis-im-sr-co-v-wynne/
22,United States v. Terminal Railroad Assn. of St. Louis,1912-04-22,https://www.courtlistener.com/opinion/97615/united-states-v-terminal-railroad-assn-of-st-louis/
23,Merchants Warehouse Co. v. United States,1931-05-18,https://www.courtlistener.com/opinion/101755/merchants-warehouse-co-v-united-states/
24,Long Island Water Supply Co. v. Brooklyn,1897-04-26,https://www.courtlistener.com/opinion/94685/long-island-water-supply-co-v-brooklyn/
25,Whitney v. Fox,1897-04-19,https://www.courtlistener.com/opinion/94681/whitney-v-fox/
26,St. Louis & San Francisco R. Co. v. Shepherd,1916-02-21,https://www.courtlistener.com/opinion/98657/st-louis-san-francisco-r-co-v-shepherd/
27,United States v. Wabash R. Co.,1944-03-27,https://www.courtlistener.com/opinion/103949/united-states-v-wabash-r-co/
28,Walla Walla v. Walla Walla Water Co.,1898-11-14,https://www.courtlistener.com/opinion/94941/walla-walla-v-walla-walla-water-co/
29,Hanks Dental Assn. v. International Tooth Crown Co.,1904-05-16,https://www.courtlistener.com/opinion/96091/hanks-dental-assn-v-international-tooth-crown-co/
30,"Thomas v. Gabrielle Brockenbrough, John Harvie, Edwin Harvie, Jacqueline Harvie, Julia Ann Harvie, Heirs at Law, and Devisees of John Harvie",1825-02-18,https://www.courtlistener.com/opinion/85457/thomas-v-gabrielle-brockenbrough-john-harvie-edwin-harvie-jacqueline/
31,Western Live Stock v. Bureau of Revenue,1938-02-28,https://www.courtlistener.com/opinion/102972/western-live-stock-v-bureau-of-revenue/
32,McCarthy v. Arndstein,1923-06-04,https://www.courtlistener.com/opinion/100229/mccarthy-v-arndstein/
33,Burnap v. United States,1920-04-19,https://www.courtlistener.com/opinion/99572/burnap-v-united-states/
34,United States v. Verdugo-Urquidez,1990-02-28,https://www.courtlistener.com/opinion/112382/united-states-v-verdugo-urquidez/
35,O'Neal v. Kirkpatrick,1867-04-29,https://www.courtlistener.com/opinion/87873/oneal-v-kirkpatrick/
36,Gordon v. Appeal Tax Court,1845-01-22,https://www.courtlistener.com/opinion/86313/gordon-v-appeal-tax-court/
37,Heck v. Humphrey,1994-06-24,https://www.courtlistener.com/opinion/117864/heck-v-humphrey/
38,United States v. Moore,1852-01-15,https://www.courtlistener.com/opinion/86688/united-states-v-moore/
39,"William S. McEwen and Henry H. Wiley, in Error v. John Den, Lessee of Charles Bulkley and Stuart Brown",1861-02-13,https://www.courtlistener.com/opinion/87392/william-s-mcewen-and-henry-h-wiley-in-error-v-john-den-lessee-of/
40,Allen v. Arguimbau,1905-05-01,https://www.courtlistener.com/opinion/96285/allen-v-arguimbau/
41,Ziang Sung Wan v. United States,1924-10-13,https://www.courtlistener.com/opinion/100471/ziang-sung-wan-v-united-states/
42,Consolidated Freightways Corporation of Delaware v. Raymond Kassel,1982-02-24,https://www.courtlistener.com/opinion/110651/consolidated-freightways-corporation-of-delaware-v-raymond-kassel/
43,Fedorenko v. United States,1981-01-21,https://www.courtlistener.com/opinion/110381/fedorenko-v-united-states/
44,"Santa Fe Industries, Inc. v. Green",1977-03-23,https://www.courtlistener.com/opinion/109626/santa-fe-industries-inc-v-green/
45,Custiss v. The Georgetown and Alexandria Turnpike Company,1810-03-18,https://www.courtlistener.com/opinion/84947/custiss-v-the-georgetown-and-alexandria-turnpike-company/
46,SS Willdomino v. Citro Chemical Co.,1927-01-03,https://www.courtlistener.com/opinion/100973/ss-willdomino-v-citro-chemical-co/
47,Parcels v. Johnson,1874-12-18,https://www.courtlistener.com/opinion/88976/parcels-v-johnson/
