,names,dates,url
0,"United States v. Thomas W. Moore, Jr., Etc.",1975-12-02,https://www.courtlistener.com/opinion/109334/united-states-v-thomas-w-moore-jr-etc/
1,Cheney v. United States Dist. Court for DC,2004-06-24,https://www.courtlistener.com/opinion/136997/cheney-v-united-states-dist-court-for-dc/
2,Oklahoma v. Texas,1925-05-11,https://www.courtlistener.com/opinion/100660/oklahoma-v-texas/
3,"Atchison, T. & SFR Co. v. United States",1921-04-18,https://www.courtlistener.com/opinion/99792/atchison-t-sfr-co-v-united-states/
4,Murdock Acceptance Corp. v. United States,1956-03-26,https://www.courtlistener.com/opinion/105368/murdock-acceptance-corp-v-united-states/
