,names,dates,url
0,Ammidon v. Smith,1816-03-22,https://www.courtlistener.com/opinion/85167/ammidon-v-smith/
1,Coppola v. United States,1961-04-17,https://www.courtlistener.com/opinion/106212/coppola-v-united-states/
2,Ronkendorff v. Taylor's Lessee,1830-03-22,https://www.courtlistener.com/opinion/85706/ronkendorff-v-taylors-lessee/
3,Kreshik v. Saint Nicholas Cathedral of Russian Orthodox Church of North America,1960-06-06,https://www.courtlistener.com/opinion/106063/kreshik-v-saint-nicholas-cathedral-of-russian-orthodox-church-of-north/
4,United States v. Johnston,1925-05-11,https://www.courtlistener.com/opinion/100655/united-states-v-johnston/
5,Wilson v. Everett,1891-04-13,https://www.courtlistener.com/opinion/93047/wilson-v-everett/
6,Connecticut Mut. Life Ins. Co. v. Cushman,1883-03-05,https://www.courtlistener.com/opinion/90824/connecticut-mut-life-ins-co-v-cushman/
7,Bryan v. Kales,1890-03-03,https://www.courtlistener.com/opinion/92713/bryan-v-kales/
8,"Christian Legal Soc. Chapter of Univ. of Cal., Hastings College of Law v. Martinez",2010-06-28,https://www.courtlistener.com/opinion/150544/christian-legal-soc-chapter-of-univ-of-cal-hastings-college-of-law-v/
9,Connecticut Dept. of Public Safety v. Doe,2003-03-05,https://www.courtlistener.com/opinion/127894/connecticut-dept-of-public-safety-v-doe/
10,"Gulf Refining Co. v. Fox, Tax Com'r of West Virginia. Ashland Refining Co. v. Same",1936-03-02,https://www.courtlistener.com/opinion/102608/gulf-refining-co-v-fox-tax-comr-of-west-virginia-ashland-refining-co/
11,Helvering v. RJ Reynolds Tobacco Co.,1939-01-30,https://www.courtlistener.com/opinion/103143/helvering-v-rj-reynolds-tobacco-co/
12,Griggs v. Provident Consumer Discount Co.,1982-11-29,https://www.courtlistener.com/opinion/110810/griggs-v-provident-consumer-discount-co/
13,Gilmer v. Interstate/Johnson Lane Corp.,1991-05-13,https://www.courtlistener.com/opinion/112584/gilmer-v-interstatejohnson-lane-corp/
14,Stevens v. Department of Treasury,1991-04-24,https://www.courtlistener.com/opinion/112582/stevens-v-department-of-treasury/
15,Hammond v. Johnston,1891-12-14,https://www.courtlistener.com/opinion/93198/hammond-v-johnston/
16,"Trade Comm'n v. Bunte Bros., Inc.",1941-02-17,https://www.courtlistener.com/opinion/103464/trade-commn-v-bunte-bros-inc/
17,"Association for Molecular Pathology v. Myriad Genetics, Inc.",2013-06-13,https://www.courtlistener.com/opinion/902772/association-for-molecular-pathology-v-myriad-genetics-inc/
18,Gonzalez v. Thaler,2012-01-10,https://www.courtlistener.com/opinion/620566/gonzalez-v-thaler/
19,"Fogerty v. Fantasy, Inc.",1994-03-01,https://www.courtlistener.com/opinion/112934/fogerty-v-fantasy-inc/
20,Marine Bank v. Kalt-Zimmers Co.,1934-12-10,https://www.courtlistener.com/opinion/102348/marine-bank-v-kalt-zimmers-co/
21,"PFZ Properties, Inc. v. Rodriguez",1992-03-09,https://www.courtlistener.com/opinion/112707/pfz-properties-inc-v-rodriguez/
22,Petersen v. Iowa Ex Rel. State Treasurer,1917-12-10,https://www.courtlistener.com/opinion/99029/petersen-v-iowa-ex-rel-state-treasurer/
23,Hormel v. Helvering,1941-03-17,https://www.courtlistener.com/opinion/103487/hormel-v-helvering/
24,Swing v. Weston Lumber Co.,1907-04-08,https://www.courtlistener.com/opinion/96641/swing-v-weston-lumber-co/
25,"Lessee of Samuel Smith, in Error v. Rober Trabue's Heirs, by James Trabue, Their Next Friend",1835-01-19,https://www.courtlistener.com/opinion/85914/lessee-of-samuel-smith-in-error-v-rober-trabues-heirs-by-james-trabue/
26,White Water Valley Canal Company v. Vallette,1859-02-21,https://www.courtlistener.com/opinion/87233/white-water-valley-canal-company-v-vallette/
27,Railroad Co. v. Orr,1873-12-15,https://www.courtlistener.com/opinion/88825/railroad-co-v-orr/
28,Palmer v. Ohio,1918-12-09,https://www.courtlistener.com/opinion/99221/palmer-v-ohio/
29,Franklin v. South Carolina,1910-05-31,https://www.courtlistener.com/opinion/97285/franklin-v-south-carolina/
30,Brown v. Hotel Employees,1984-07-02,https://www.courtlistener.com/opinion/111251/brown-v-hotel-employees/
31,Maryland Casualty Co. v. Cushing,1954-04-12,https://www.courtlistener.com/opinion/105217/maryland-casualty-co-v-cushing/
32,"US Term Limits, Inc. v. Thornton",1995-05-22,https://www.courtlistener.com/opinion/117935/us-term-limits-inc-v-thornton/
33,Hutchinson Ice Cream Co. v. Iowa,1916-12-04,https://www.courtlistener.com/opinion/98810/hutchinson-ice-cream-co-v-iowa/
34,Grand Trunk Western R. Co. v. United States,1920-03-01,https://www.courtlistener.com/opinion/99533/grand-trunk-western-r-co-v-united-states/
35,Barefoot v. Estelle,1983-07-06,https://www.courtlistener.com/opinion/111017/barefoot-v-estelle/
36,"Currie, Mayor v. United States Ex Rel. Jacobs",1889-01-07,https://www.courtlistener.com/opinion/92381/currie-mayor-v-united-states-ex-rel-jacobs/
37,"Currie, Mayor v. United States Ex Rel. Jacobs",1889-01-07,https://www.courtlistener.com/opinion/92381/currie-mayor-v-united-states-ex-rel-jacobs/
38,Fourth Street Bank of Philadelphia v. Yardley,1897-03-01,https://www.courtlistener.com/opinion/94636/fourth-street-bank-of-philadelphia-v-yardley/
39,Muniz v. Hoffman,1975-06-25,https://www.courtlistener.com/opinion/109300/muniz-v-hoffman/
40,Drummond v. United States,1945-03-05,https://www.courtlistener.com/opinion/104101/drummond-v-united-states/
41,Western Pacific R. Co. v. United States,1925-05-11,https://www.courtlistener.com/opinion/100663/western-pacific-r-co-v-united-states/
42,Pickett v. United States,1910-02-21,https://www.courtlistener.com/opinion/97191/pickett-v-united-states/
43,Stuart v. Union Pacific R. Co.,1913-02-24,https://www.courtlistener.com/opinion/97786/stuart-v-union-pacific-r-co/
44,Whitcomb v. Smithson,1900-01-08,https://www.courtlistener.com/opinion/95147/whitcomb-v-smithson/
45,Pufahl v. Estate of Parks,1936-12-07,https://www.courtlistener.com/opinion/102718/pufahl-v-estate-of-parks/
46,Martin v. District of Columbia,1907-03-11,https://www.courtlistener.com/opinion/96628/martin-v-district-of-columbia/
47,"Furness, Withy & Co. v. Yang-Tsze Ins. Assn., Ltd.",1917-01-08,https://www.courtlistener.com/opinion/98847/furness-withy-co-v-yang-tsze-ins-assn-ltd/
48,Draper v. Davis,1882-01-18,https://www.courtlistener.com/opinion/90465/draper-v-davis/
49,Office of Senator Mark Dayton v. Hanson,2007-05-21,https://www.courtlistener.com/opinion/145732/office-of-senator-mark-dayton-v-hanson/
50,United States v. National Assn. of Real Estate Bds.,1950-06-05,https://www.courtlistener.com/opinion/104794/united-states-v-national-assn-of-real-estate-bds/
51,United States v. Vaca,1856-05-12,https://www.courtlistener.com/opinion/87046/united-states-v-vaca/
52,"Richard R. Keene, in Error v. The Heirs of Daniel Clark",1836-02-19,https://www.courtlistener.com/opinion/85971/richard-r-keene-in-error-v-the-heirs-of-daniel-clark/
53,Henderson's Tobacco,1871-05-18,https://www.courtlistener.com/opinion/88356/hendersons-tobacco/
54,Kidd v. Alabama,1903-02-23,https://www.courtlistener.com/opinion/95818/kidd-v-alabama/
55,Black v. Magnolia Liquor Co.,1957-11-12,https://www.courtlistener.com/opinion/105565/black-v-magnolia-liquor-co/
56,Graham v. West Virginia,1912-05-13,https://www.courtlistener.com/opinion/97635/graham-v-west-virginia/
57,Schwartz v. Duss,1902-10-27,https://www.courtlistener.com/opinion/95705/schwartz-v-duss/
58,Last Chance Mining Co. v. Tyler Mining Co.,1895-04-15,https://www.courtlistener.com/opinion/94182/last-chance-mining-co-v-tyler-mining-co/
59,American Publishing Co. v. Fisher,1897-04-12,https://www.courtlistener.com/opinion/94664/american-publishing-co-v-fisher/
60,Lanier v. Nash,1887-04-18,https://www.courtlistener.com/opinion/91932/lanier-v-nash/
61,Cunningham v. California,2007-01-22,https://www.courtlistener.com/opinion/145761/cunningham-v-california/
62,Phelps v. United States,1975-05-19,https://www.courtlistener.com/opinion/109249/phelps-v-united-states/
63,Mellen v. Moline Malleable Iron Works,1889-05-13,https://www.courtlistener.com/opinion/92548/mellen-v-moline-malleable-iron-works/
64,Green v. Bogue,1895-05-27,https://www.courtlistener.com/opinion/94233/green-v-bogue/
65,Tredway v. Sanger,1883-04-23,https://www.courtlistener.com/opinion/90765/tredway-v-sanger/
66,McAllister v. Kuhn,1878-01-18,https://www.courtlistener.com/opinion/89673/mcallister-v-kuhn/
67,Firestone Tire & Rubber Co. v. Bruch,1989-02-21,https://www.courtlistener.com/opinion/112197/firestone-tire-rubber-co-v-bruch/
68,Denver v. Roane,1879-05-18,https://www.courtlistener.com/opinion/89954/denver-v-roane/
69,The John Griffin,1873-01-18,https://www.courtlistener.com/opinion/88579/the-john-griffin/
70,United States v. Jones,1890-03-31,https://www.courtlistener.com/opinion/92745/united-states-v-jones/
71,Westfall v. United States,1927-05-16,https://www.courtlistener.com/opinion/101082/westfall-v-united-states/
72,Kern County Land Co. v. Occidental Petroleum Corp.,1973-05-07,https://www.courtlistener.com/opinion/108776/kern-county-land-co-v-occidental-petroleum-corp/
73,Jones v. League,1855-12-18,https://www.courtlistener.com/opinion/86976/jones-v-league/
