,names,dates,url
0,"Kulko v. Superior Court of Cal., City and County of San Francisco",1978-06-26,https://www.courtlistener.com/opinion/109858/kulko-v-superior-court-of-cal-city-and-county-of-san-francisco/
1,Sandoval v. Randolph,1911-12-04,https://www.courtlistener.com/opinion/97479/sandoval-v-randolph/
2,Jennings v. Coal Ridge Improvement & Coal Co.,1893-01-03,https://www.courtlistener.com/opinion/93478/jennings-v-coal-ridge-improvement-coal-co/
3,Continental Nat. Bank of Memphis v. Buford,1903-11-16,https://www.courtlistener.com/opinion/95932/continental-nat-bank-of-memphis-v-buford/
4,Essanay Film Mfg. Co. v. Kane,1922-04-10,https://www.courtlistener.com/opinion/99961/essanay-film-mfg-co-v-kane/
5,United States v. Howard,1957-01-14,https://www.courtlistener.com/opinion/105438/united-states-v-howard/
6,Edelman v. Jordan,1974-05-13,https://www.courtlistener.com/opinion/108990/edelman-v-jordan/
7,Stewart v. Keyes,1935-05-20,https://www.courtlistener.com/opinion/102465/stewart-v-keyes/
8,Custiss v. The Georgetown and Alexandria Turnpike Company,1810-03-18,https://www.courtlistener.com/opinion/84947/custiss-v-the-georgetown-and-alexandria-turnpike-company/
