,names,dates,url
0,Illinois Ex Rel. Gersch v. Chicago,1913-01-06,https://www.courtlistener.com/opinion/97732/illinois-ex-rel-gersch-v-chicago/
1,Sullivan v. United States,1969-05-26,https://www.courtlistener.com/opinion/107943/sullivan-v-united-states/
2,The Sir William Peel,1867-05-16,https://www.courtlistener.com/opinion/87850/the-sir-william-peel/
3,Michelson v. United States,1949-02-14,https://www.courtlistener.com/opinion/104607/michelson-v-united-states/
4,United States v. Plesha,1957-01-14,https://www.courtlistener.com/opinion/105437/united-states-v-plesha/
5,Cross v. North Carolina,1889-11-11,https://www.courtlistener.com/opinion/92577/cross-v-north-carolina/
6,Cameron v. United States,1914-01-05,https://www.courtlistener.com/opinion/98050/cameron-v-united-states/
