,names,dates,url
0,"Chicago, St. P., M. & OR Co. v. United States",1910-04-04,https://www.courtlistener.com/opinion/97228/chicago-st-p-m-or-co-v-united-states/
1,United States v. Powell,1947-03-03,https://www.courtlistener.com/opinion/104383/united-states-v-powell/
2,United States v. Union Pacific R. Co.,1919-03-31,https://www.courtlistener.com/opinion/99340/united-states-v-union-pacific-r-co/
3,Lake Superior & Miss. RR Co. v. United States,1877-01-15,https://www.courtlistener.com/opinion/89399/lake-superior-miss-rr-co-v-united-states/
4,United States v. GALVESTON & C. RY. CO.,1929-05-13,https://www.courtlistener.com/opinion/101429/united-states-v-galveston-c-ry-co/
5,Southern Pacific Co. v. United States,1932-03-14,https://www.courtlistener.com/opinion/101885/southern-pacific-co-v-united-states/
6,Krug v. Santa Fe Pacific R. Co.,1947-02-03,https://www.courtlistener.com/opinion/104364/krug-v-santa-fe-pacific-r-co/
