,names,dates,url
0,"McNutt Ex Rel. Leggett, Smith, & Lawrence v. Bland",1844-01-30,https://www.courtlistener.com/opinion/86263/mcnutt-ex-rel-leggett-smith-lawrence-v-bland/
1,Duncan v. Darst,1843-03-14,https://www.courtlistener.com/opinion/86261/duncan-v-darst/
2,American Surety Co. v. Westinghouse Elec. Mfg. Co.,1935-11-11,https://www.courtlistener.com/opinion/102499/american-surety-co-v-westinghouse-elec-mfg-co/
3,Phillips-Jones Corp. v. Parmley,1937-12-06,https://www.courtlistener.com/opinion/102869/phillips-jones-corp-v-parmley/
4,Bachrack v. Norton,1889-12-09,https://www.courtlistener.com/opinion/92608/bachrack-v-norton/
5,Maryland v. Baldwin,1884-12-15,https://www.courtlistener.com/opinion/1744922/maryland-v-baldwin/
6,United States Fidelity & Guaranty Co. v. United States Ex Rel. Kenyon,1907-02-25,https://www.courtlistener.com/opinion/96589/united-states-fidelity-guaranty-co-v-united-states-ex-rel-kenyon/
7,Aetna Life Ins. Co. v. Middleport,1888-02-06,https://www.courtlistener.com/opinion/92152/aetna-life-ins-co-v-middleport/
8,Leighton v. United States,1933-05-29,https://www.courtlistener.com/opinion/102109/leighton-v-united-states/
9,Wabash R. Co. v. Pearce,1904-01-11,https://www.courtlistener.com/opinion/95988/wabash-r-co-v-pearce/
10,Feibelman v. Packard,1883-12-03,https://www.courtlistener.com/opinion/90951/feibelman-v-packard/
11,Amer. Surety Co. v. Bethlehem Bank,1941-12-08,https://www.courtlistener.com/opinion/103565/amer-surety-co-v-bethlehem-bank/
12,Hampton v. Phipps,1883-04-16,https://www.courtlistener.com/opinion/90854/hampton-v-phipps/
13,United States v. McMullen,1912-01-09,https://www.courtlistener.com/opinion/97515/united-states-v-mcmullen/
14,Equitable Surety Co. v. United States Ex Rel. McMillan,1914-06-22,https://www.courtlistener.com/opinion/98240/equitable-surety-co-v-united-states-ex-rel-mcmillan/
15,"Otis v. Cullum, Receiver",1876-01-24,https://www.courtlistener.com/opinion/89293/otis-v-cullum-receiver/
16,Connecticut Mut. Life Ins. Co. v. Hillmon,1903-02-02,https://www.courtlistener.com/opinion/95778/connecticut-mut-life-ins-co-v-hillmon/
17,United States Ex Rel. Texas Portland Cement Co. v. McCord,1914-04-06,https://www.courtlistener.com/opinion/98143/united-states-ex-rel-texas-portland-cement-co-v-mccord/
18,United States v. National Surety Co.,1920-11-08,https://www.courtlistener.com/opinion/99642/united-states-v-national-surety-co/
19,Munroe v. Raphael,1933-03-13,https://www.courtlistener.com/opinion/102055/munroe-v-raphael/
20,Prairie State Bank v. United States,1896-11-30,https://www.courtlistener.com/opinion/94533/prairie-state-bank-v-united-states/
21,Utley v. Donaldson,1877-01-15,https://www.courtlistener.com/opinion/89432/utley-v-donaldson/
22,United States v. Munsey Trust Co.,1947-06-23,https://www.courtlistener.com/opinion/104464/united-states-v-munsey-trust-co/
23,United States Ex Rel. Midland Loan Finance Co. v. National Surety Corp.,1940-02-05,https://www.courtlistener.com/opinion/103297/united-states-ex-rel-midland-loan-finance-co-v-national-surety-corp/
24,Arnold v. United States Ex Rel. WB Guimarin & Co.,1924-01-07,https://www.courtlistener.com/opinion/100311/arnold-v-united-states-ex-rel-wb-guimarin-co/
25,Henningsen v. United States Fidelity & Guaranty Co. of Baltimore,1908-02-24,https://www.courtlistener.com/opinion/96785/henningsen-v-united-states-fidelity-guaranty-co-of-baltimore/
26,Mutual Life Ins. Co. v. Hillmon,1892-05-16,https://www.courtlistener.com/opinion/93380/mutual-life-ins-co-v-hillmon/
27,Pearlman v. Reliance Ins. Co.,1962-12-03,https://www.courtlistener.com/opinion/106494/pearlman-v-reliance-ins-co/
28,Howard v. United States,1902-01-20,https://www.courtlistener.com/opinion/95625/howard-v-united-states/
29,Dooley v. Smith,1872-02-18,https://www.courtlistener.com/opinion/88496/dooley-v-smith/
30,Gaines v. Relf,1852-03-18,https://www.courtlistener.com/opinion/86713/gaines-v-relf/
31,Ex Parte Southwestern Surety Ins. Co.,1918-05-20,https://www.courtlistener.com/opinion/99164/ex-parte-southwestern-surety-ins-co/
32,A. Bryant Co. v. NY Steam Fitting Co.,1914-12-07,https://www.courtlistener.com/opinion/98300/a-bryant-co-v-ny-steam-fitting-co/
33,Corporation of Washington Ex Rel. McCue v. Young,1825-03-21,https://www.courtlistener.com/opinion/85469/corporation-of-washington-ex-rel-mccue-v-young/
34,Davidson Bros. Marble Co. v. United States Ex Rel. Gibson,1909-02-23,https://www.courtlistener.com/opinion/96990/davidson-bros-marble-co-v-united-states-ex-rel-gibson/
35,Pence v. United States,1942-05-25,https://www.courtlistener.com/opinion/103683/pence-v-united-states/
36,United States Fidelity & Guaranty Co. v. United States Ex Rel. Struthers Wells Co.,1908-04-06,https://www.courtlistener.com/opinion/96829/united-states-fidelity-guaranty-co-v-united-states-ex-rel-struthers/
37,New York Ex Rel. Troy Union R. Co. v. Mealy,1920-11-08,https://www.courtlistener.com/opinion/99637/new-york-ex-rel-troy-union-r-co-v-mealy/
38,McKee v. Rains,1870-04-18,https://www.courtlistener.com/opinion/88233/mckee-v-rains/
39,Guaranty Co. v. Pressed Brick Co.,1903-12-07,https://www.courtlistener.com/opinion/95957/guaranty-co-v-pressed-brick-co/
40,New Orleans v. Gaines's Administrator,1891-03-02,https://www.courtlistener.com/opinion/92983/new-orleans-v-gainess-administrator/
41,Meyer v. Richards,1896-05-25,https://www.courtlistener.com/opinion/94496/meyer-v-richards/
42,Jenkins v. National Surety Co.,1928-05-14,https://www.courtlistener.com/opinion/101305/jenkins-v-national-surety-co/
43,Lidderdale's Executors v. of Robinson,1827-02-17,https://www.courtlistener.com/opinion/85554/lidderdales-executors-v-of-robinson/
44,Memphis & Little Rock R. Co. v. Dow,1887-02-07,https://www.courtlistener.com/opinion/91851/memphis-little-rock-r-co-v-dow/
45,Miller v. American Bonding Co.,1921-12-12,https://www.courtlistener.com/opinion/99885/miller-v-american-bonding-co/
46,Prudence Realization Corp. v. Geist,1942-04-27,https://www.courtlistener.com/opinion/103658/prudence-realization-corp-v-geist/
47,"Department of Army v. Blue Fox, Inc.",1999-01-20,https://www.courtlistener.com/opinion/118256/department-of-army-v-blue-fox-inc/
48,Rice v. Houston,1871-12-11,https://www.courtlistener.com/opinion/88436/rice-v-houston/
49,Illinois Surety Co. v. United States Ex Rel. Peeler,1916-02-21,https://www.courtlistener.com/opinion/98654/illinois-surety-co-v-united-states-ex-rel-peeler/
50,American Surety Co. of NY v. Sampsell,1946-02-25,https://www.courtlistener.com/opinion/104242/american-surety-co-of-ny-v-sampsell/
51,Title Guaranty & Surety Co. v. United States Ex Rel. Harlan & Hollingsworth,1913-05-12,https://www.courtlistener.com/opinion/97874/title-guaranty-surety-co-v-united-states-ex-rel-harlan-hollingsworth/
52,United States v. Ansonia Brass & Copper Co.,1910-11-28,https://www.courtlistener.com/opinion/97313/united-states-v-ansonia-brass-copper-co/
53,Prudence Realization Corp. v. Ferris,1945-01-29,https://www.courtlistener.com/opinion/104071/prudence-realization-corp-v-ferris/
