,names,dates,url
0,Van Dyke v. Arizona Eastern R. Co.,1918-12-09,https://www.courtlistener.com/opinion/99224/van-dyke-v-arizona-eastern-r-co/
1,Stalker v. Oregon Short Line R. Co.,1912-05-27,https://www.courtlistener.com/opinion/97649/stalker-v-oregon-short-line-r-co/
2,"Minneapolis, St. P. & S. Ste. MR Co. v. Doughty",1908-02-03,https://www.courtlistener.com/opinion/96771/minneapolis-st-p-s-ste-mr-co-v-doughty/
3,Jamestown & Northern R. Co. v. Jones,1900-03-26,https://www.courtlistener.com/opinion/95221/jamestown-northern-r-co-v-jones/
4,Barlow v. Northern Pacific R. Co.,1916-04-03,https://www.courtlistener.com/opinion/98685/barlow-v-northern-pacific-r-co/
