,names,dates,url
0,Manning v. Seeley Tube & Box Co.,1950-02-06,https://www.courtlistener.com/opinion/104753/manning-v-seeley-tube-box-co/
1,Lewyt Corp. v. Commissioner,1955-05-23,https://www.courtlistener.com/opinion/105309/lewyt-corp-v-commissioner/
2,United Cal. Bank v. United States,1978-12-11,https://www.courtlistener.com/opinion/109955/united-cal-bank-v-united-states/
3,"Libson Shops, Inc. v. Gustave F. Koehler, District Director of Internal Revenue",1957-06-24,https://www.courtlistener.com/opinion/105507/libson-shops-inc-v-gustave-f-koehler-district-director-of-internal/
4,United States v. Foster Lumber Co.,1976-11-02,https://www.courtlistener.com/opinion/109555/united-states-v-foster-lumber-co/
5,United States v. Koppers Co.,1955-03-14,https://www.courtlistener.com/opinion/105267/united-states-v-koppers-co/
