,names,dates,url
0,Black v. JW Zacharie & Co.,1845-01-17,https://www.courtlistener.com/opinion/86326/black-v-jw-zacharie-co/
1,Union National Bank v. LOUISVILLE &C. R'Y.,1896-05-18,https://www.courtlistener.com/opinion/94489/union-national-bank-v-louisville-c-ry/
2,Conard v. Pacific Ins. Co. of NY,1832-01-28,https://www.courtlistener.com/opinion/85780/conard-v-pacific-ins-co-of-ny/
3,Johnston v. Laflin,1881-04-18,https://www.courtlistener.com/opinion/90410/johnston-v-laflin/
4,The Mechanics Bank of Alexandria v. LOUISA & MARIA SETON,1828-01-30,https://www.courtlistener.com/opinion/85583/the-mechanics-bank-of-alexandria-v-louisa-maria-seton/
5,"Robert Y. Brent, Surviving of Robert Brent, Use of the United States v. The President and Directors of the Bank of Washington",1836-02-26,https://www.courtlistener.com/opinion/86000/robert-y-brent-surviving-of-robert-brent-use-of-the-united-states-v-the/
6,Union Bank of Georgetown v. Laird,1817-03-15,https://www.courtlistener.com/opinion/85210/union-bank-of-georgetown-v-laird/
7,Welch v. Mandeville,1816-03-11,https://www.courtlistener.com/opinion/85153/welch-v-mandeville/
8,Leyson v. Davis,1898-04-11,https://www.courtlistener.com/opinion/94845/leyson-v-davis/
