,names,dates,url
0,United States v. Dudley,1899-05-22,https://www.courtlistener.com/opinion/95091/united-states-v-dudley/
1,Forged Steel Wheel Co. v. Lewellyn,1920-03-01,https://www.courtlistener.com/opinion/99515/forged-steel-wheel-co-v-lewellyn/
2,United States v. Shelley,1913-05-26,https://www.courtlistener.com/opinion/97916/united-states-v-shelley/
3,Tide Water Oil Co. v. United States,1898-05-31,https://www.courtlistener.com/opinion/94909/tide-water-oil-co-v-united-states/
4,Joseph Schlitz Brewing Co. v. United States,1901-05-20,https://www.courtlistener.com/opinion/95496/joseph-schlitz-brewing-co-v-united-states/
5,Jordan v. Roche,1913-04-28,https://www.courtlistener.com/opinion/97859/jordan-v-roche/
6,Anheuser-Busch Brewing Assn. v. United States,1908-01-06,https://www.courtlistener.com/opinion/96747/anheuser-busch-brewing-assn-v-united-states/
