,names,dates,url
0,Blair v. Cuming County,1884-04-21,https://www.courtlistener.com/opinion/91120/blair-v-cuming-county/
1,Osborne v. County of Adams,1882-11-20,https://www.courtlistener.com/opinion/90663/osborne-v-county-of-adams/
2,Burlington v. Beasley,1877-03-26,https://www.courtlistener.com/opinion/89470/burlington-v-beasley/
3,Osborne v. Adams County,1883-10-15,https://www.courtlistener.com/opinion/90896/osborne-v-adams-county/
4,MacKall v. Chesapeake and Ohio Canal Company,1877-03-26,https://www.courtlistener.com/opinion/89469/mackall-v-chesapeake-and-ohio-canal-company/
