,names,dates,url
0,Union Trust Co. v. Southern Inland Nav. & Improvement Co.,1889-04-15,https://www.courtlistener.com/opinion/92498/union-trust-co-v-southern-inland-nav-improvement-co/
1,Littlefield v. Trustees of Internal Improvement Fund of Fla.,1886-04-05,https://www.courtlistener.com/opinion/91626/littlefield-v-trustees-of-internal-improvement-fund-of-fla/
2,Railroad Cos. v. Schutte,1881-01-17,https://www.courtlistener.com/opinion/90307/railroad-cos-v-schutte/
3,State of Florida v. ANDERSON,1875-12-13,https://www.courtlistener.com/opinion/89229/state-of-florida-v-anderson/
4,Thompson v. Baker,1891-12-07,https://www.courtlistener.com/opinion/93185/thompson-v-baker/
