,names,dates,url
0,City of Douglas v. Federal Reserve Bank of Dallas,1926-06-07,https://www.courtlistener.com/opinion/100905/city-of-douglas-v-federal-reserve-bank-of-dallas/
1,Townsley v. Sumrall,1829-02-10,https://www.courtlistener.com/opinion/85624/townsley-v-sumrall/
2,Early v. Federal Reserve Bank of Richmond,1930-03-12,https://www.courtlistener.com/opinion/101536/early-v-federal-reserve-bank-of-richmond/
3,Federal Reserve Bank of Richmond v. Malloy,1924-02-18,https://www.courtlistener.com/opinion/100360/federal-reserve-bank-of-richmond-v-malloy/
4,Dakin v. Bayly,1933-11-20,https://www.courtlistener.com/opinion/102142/dakin-v-bayly/
5,Exchange Nat. Bank of Pittsburgh v. Third Nat. Bank of NY,1884-11-24,https://www.courtlistener.com/opinion/91207/exchange-nat-bank-of-pittsburgh-v-third-nat-bank-of-ny/
6,Latzko v. Equitable Trust Co.,1927-11-28,https://www.courtlistener.com/opinion/101175/latzko-v-equitable-trust-co/
