,names,dates,url
0,Walling v. AH Belo Corp.,1942-06-08,https://www.courtlistener.com/opinion/103706/walling-v-ah-belo-corp/
1,149 Madison Ave. Corp. v. Asselta,1947-06-16,https://www.courtlistener.com/opinion/104423/149-madison-ave-corp-v-asselta/
2,"Walling v. Helmerich & Payne, Inc.",1944-12-18,https://www.courtlistener.com/opinion/104022/walling-v-helmerich-payne-inc/
3,Walling v. Halliburton Oil Well Cementing Co.,1947-04-14,https://www.courtlistener.com/opinion/104413/walling-v-halliburton-oil-well-cementing-co/
4,Walling v. Harnischfeger Corp.,1945-06-04,https://www.courtlistener.com/opinion/104154/walling-v-harnischfeger-corp/
5,Bay Ridge Operating Co. v. Aaron,1948-10-11,https://www.courtlistener.com/opinion/104566/bay-ridge-operating-co-v-aaron/
6,Walling v. Youngerman-Reynolds Hardwood Co.,1945-06-04,https://www.courtlistener.com/opinion/104153/walling-v-youngerman-reynolds-hardwood-co/
7,United States v. Rosenwasser,1945-01-08,https://www.courtlistener.com/opinion/104052/united-states-v-rosenwasser/
8,United States v. Townsley,1945-01-15,https://www.courtlistener.com/opinion/104062/united-states-v-townsley/
