,names,dates,url
0,US Printing Co. v. Griggs & Co.,1929-04-08,https://www.courtlistener.com/opinion/101405/us-printing-co-v-griggs-co/
1,"A. Bourjois & Co., Inc. v. Katzel",1922-10-09,https://www.courtlistener.com/opinion/100110/a-bourjois-co-inc-v-katzel/
2,Saxlehner v. Eisner & Mendelson Co.,1900-10-15,https://www.courtlistener.com/opinion/95328/saxlehner-v-eisner-mendelson-co/
3,Saxlehner v. Siegel-Cooper Co.,1900-10-15,https://www.courtlistener.com/opinion/95329/saxlehner-v-siegel-cooper-co/
4,Mishawaka Rubber & Woolen Mfg. Co. v. SS Kresge Co.,1942-05-04,https://www.courtlistener.com/opinion/103672/mishawaka-rubber-woolen-mfg-co-v-ss-kresge-co/
5,Saxlehner v. Wagner,1910-02-21,https://www.courtlistener.com/opinion/97182/saxlehner-v-wagner/
6,Hanover Star Milling Co. v. Metcalf,1916-03-13,https://www.courtlistener.com/opinion/98674/hanover-star-milling-co-v-metcalf/
7,Canal Co. v. Clark,1872-02-26,https://www.courtlistener.com/opinion/88466/canal-co-v-clark/
8,Lawrence Mfg. Co. v. Tennessee Mfg. Co.,1891-03-02,https://www.courtlistener.com/opinion/92978/lawrence-mfg-co-v-tennessee-mfg-co/
9,Goodyear's India Rubber Glove Mfg. Co. v. Goodyear Rubber Co.,1888-12-10,https://www.courtlistener.com/opinion/92370/goodyears-india-rubber-glove-mfg-co-v-goodyear-rubber-co/
10,Baglin v. Cusenier Co.,1911-05-29,https://www.courtlistener.com/opinion/97449/baglin-v-cusenier-co/
11,Ryder v. Holt,1888-12-10,https://www.courtlistener.com/opinion/92360/ryder-v-holt/
12,G. & C. Merriam Co. v. Syndicate Publishing Co.,1915-06-01,https://www.courtlistener.com/opinion/98478/g-c-merriam-co-v-syndicate-publishing-co/
13,Champion Spark Plug Co. v. Sanders,1947-04-28,https://www.courtlistener.com/opinion/104420/champion-spark-plug-co-v-sanders/
14,Herring-Hall-Marvin Safe Co. v. Hall's Safe Co.,1908-02-24,https://www.courtlistener.com/opinion/96801/herring-hall-marvin-safe-co-v-halls-safe-co/
15,Smith v. Whitman Saddle Co.,1893-04-17,https://www.courtlistener.com/opinion/93592/smith-v-whitman-saddle-co/
16,United Drug Co. v. Theodore Rectanus Co.,1918-12-09,https://www.courtlistener.com/opinion/99231/united-drug-co-v-theodore-rectanus-co/
17,Coats v. Merrick Thread Co.,1893-05-10,https://www.courtlistener.com/opinion/93651/coats-v-merrick-thread-co/
18,Singer Mfg. Co. v. June Mfg. Co.,1896-05-18,https://www.courtlistener.com/opinion/94476/singer-mfg-co-v-june-mfg-co/
19,Worden v. California Fig Syrup Co.,1903-01-05,https://www.courtlistener.com/opinion/95755/worden-v-california-fig-syrup-co/
20,Holzapfel's Co. v. Rahtjen's Co.,1901-10-21,https://www.courtlistener.com/opinion/95524/holzapfels-co-v-rahtjens-co/
21,Manufacturing Co. v. Trainer,1880-04-12,https://www.courtlistener.com/opinion/90091/manufacturing-co-v-trainer/
22,Gorham Co. v. White,1872-11-18,https://www.courtlistener.com/opinion/88561/gorham-co-v-white/
23,Menendez v. Holt,1888-12-10,https://www.courtlistener.com/opinion/92359/menendez-v-holt/
24,Internat'l News Serv. v. Asso. Press,1919-01-07,https://www.courtlistener.com/opinion/99248/internatl-news-serv-v-asso-press/
25,Perris v. Hexamer,1879-02-18,https://www.courtlistener.com/opinion/89997/perris-v-hexamer/
26,Standard Paint Co. v. Trinidad Asphalt Mfg. Co.,1911-04-17,https://www.courtlistener.com/opinion/97401/standard-paint-co-v-trinidad-asphalt-mfg-co/
27,American Trading Co. v. HE Heacock Co.,1932-03-21,https://www.courtlistener.com/opinion/101886/american-trading-co-v-he-heacock-co/
28,Thaddeus Davids Co. v. Davids Mfg. Co.,1914-04-27,https://www.courtlistener.com/opinion/98170/thaddeus-davids-co-v-davids-mfg-co/
29,French Republic v. Saratoga Vichy Spring Co.,1903-12-07,https://www.courtlistener.com/opinion/95958/french-republic-v-saratoga-vichy-spring-co/
30,Warner v. Searle & Hereth Co.,1903-11-30,https://www.courtlistener.com/opinion/95940/warner-v-searle-hereth-co/
31,Ferris v. Frohman,1912-02-19,https://www.courtlistener.com/opinion/97559/ferris-v-frohman/
32,"Prestonettes, Inc. v. Coty",1924-04-07,https://www.courtlistener.com/opinion/100383/prestonettes-inc-v-coty/
33,Corbin v. Gould,1890-02-03,https://www.courtlistener.com/opinion/92671/corbin-v-gould/
34,McLean v. Fleming,1878-04-29,https://www.courtlistener.com/opinion/89701/mclean-v-fleming/
35,Higgins v. Keuffel,1891-05-11,https://www.courtlistener.com/opinion/93104/higgins-v-keuffel/
36,"St. Paul, M. & M. Ry. Co. v. Wenzel",1891-03-02,https://www.courtlistener.com/opinion/92992/st-paul-m-m-ry-co-v-wenzel/
37,Columbia Mill Co. v. Alcorn,1893-12-04,https://www.courtlistener.com/opinion/93721/columbia-mill-co-v-alcorn/
38,Donnell v. Herring-Hall-Marvin Safe Co.,1908-02-03,https://www.courtlistener.com/opinion/96773/donnell-v-herring-hall-marvin-safe-co/
39,Jacobs v. Beecham,1911-05-15,https://www.courtlistener.com/opinion/97422/jacobs-v-beecham/
40,Straus v. Notaseme Hosiery Co.,1916-02-21,https://www.courtlistener.com/opinion/98651/straus-v-notaseme-hosiery-co/
41,Ingenohl v. Olsen & Co.,1927-03-21,https://www.courtlistener.com/opinion/101033/ingenohl-v-olsen-co/
42,Manhattan Medicine Co. v. Wood,1883-04-02,https://www.courtlistener.com/opinion/90849/manhattan-medicine-co-v-wood/
43,"Estate of PD Beckwith, Inc. v. Commissioner of Patents",1920-04-19,https://www.courtlistener.com/opinion/99575/estate-of-pd-beckwith-inc-v-commissioner-of-patents/
44,Elgin Nat. Watch Co. v. Illinois Watch Case Co.,1901-01-07,https://www.courtlistener.com/opinion/95388/elgin-nat-watch-co-v-illinois-watch-case-co/
45,LE Waterman Co. v. Modern Pen Co.,1914-11-30,https://www.courtlistener.com/opinion/98278/le-waterman-co-v-modern-pen-co/
46,Brown Chemical Co. v. Meyer,1891-03-23,https://www.courtlistener.com/opinion/93037/brown-chemical-co-v-meyer/
47,"Howe Scale Co. v. Wyckoff, Seamans & Benedict",1905-04-24,https://www.courtlistener.com/opinion/96282/howe-scale-co-v-wyckoff-seamans-benedict/
