,names,dates,url
0,Martin v. District of Columbia Court of Appeals,1992-11-02,https://www.courtlistener.com/opinion/112790/martin-v-district-of-columbia-court-of-appeals/
1,"Robert Attwood v. Harry K. Singletary, Jr., Secretary, Florida Department of Corrections",1996-01-22,https://www.courtlistener.com/opinion/117995/robert-attwood-v-harry-k-singletary-jr-secretary-florida-department/
2,Sylvester Jones v. Abc-Tv,1996-02-26,https://www.courtlistener.com/opinion/117999/sylvester-jones-v-abc-tv/
3,Zatko v. California,1991-11-04,https://www.courtlistener.com/opinion/112656/zatko-v-california/
4,Shieh v. Kakita,1996-04-16,https://www.courtlistener.com/opinion/118016/shieh-v-kakita/
