,names,dates,url
0,Telegraph Co. v. Davenport,1878-11-18,https://www.courtlistener.com/opinion/89802/telegraph-co-v-davenport/
1,Moores v. Citizens' Nat. Bank of Piqua,1884-03-31,https://www.courtlistener.com/opinion/91096/moores-v-citizens-nat-bank-of-piqua/
2,St. Romes v. Levee Steam Cotton Press Co.,1888-05-14,https://www.courtlistener.com/opinion/92288/st-romes-v-levee-steam-cotton-press-co/
3,Loring v. Frue,1881-11-21,https://www.courtlistener.com/opinion/90448/loring-v-frue/
4,MacKenzie v. A. Engelhard & Sons Co.,1924-11-17,https://www.courtlistener.com/opinion/100485/mackenzie-v-a-engelhard-sons-co/
