,names,dates,url
0,Commissioner v. Court Holding Co.,1945-04-09,https://www.courtlistener.com/opinion/104103/commissioner-v-court-holding-co/
1,Clark v. Hackett,1862-01-27,https://www.courtlistener.com/opinion/87440/clark-v-hackett/
2,Stolt-Nielsen S. A. v. AnimalFeeds Int’l Corp.,2010-04-27,https://www.courtlistener.com/opinion/78783/stolt-nielsen-s-a-v-animalfeeds-intl-corp/
3,"Thomas E. Ellis, Jonathan M. Hill, Daniel Roper, and T. B. Bethea, in Error v. Thomas Jones, Administrator of Montraville D. Taylor, Deceased",1843-02-22,https://www.courtlistener.com/opinion/86248/thomas-e-ellis-jonathan-m-hill-daniel-roper-and-t-b-bethea-in-error/
4,Greer v. Spock,1976-03-24,https://www.courtlistener.com/opinion/109406/greer-v-spock/
5,Palmer v. Webster and Atlas Nat. Bank of Boston,1941-03-03,https://www.courtlistener.com/opinion/103444/palmer-v-webster-and-atlas-nat-bank-of-boston/
6,"Cooper Industries, Inc. v. Aviall Services, Inc.",2004-12-13,https://www.courtlistener.com/opinion/137734/cooper-industries-inc-v-aviall-services-inc/
7,Hall v. MacNeale,1883-02-18,https://www.courtlistener.com/opinion/90746/hall-v-macneale/
